,Ticker,Headline,Date,Time,neg,neu,pos,compound
1914,SBILIFE,SBI Life Insurance Company informs about newspaper advertisement,2022/08/06,15:44,0.131,0.437,0.432,0.1905
1915,SBILIFE,SBI Life Insurance Company reports 18% rise in Q1 net profit,2022/08/01,11:45,0.274,0.326,0.4,0.1388
1916,SBILIFE,SBI Life Insuran - Quaterly Results,2022/07/28,18:15,0.0,0.712,0.288,0.1581
1917,SBILIFE,SBI Life Insuran - Quaterly Results,2022/07/28,18:15,0.0,0.712,0.288,0.1581
1918,SBILIFE,SBI Life Insurance inks bancassurance pact with Paschim Banga Gramin Bank,2022/07/01,09:13,0.188,0.582,0.23,0.1311
1919,SBILIFE,SBI Life Insurance Company reports 26% rise in Q4 net profit,2022/04/30,10:04,0.274,0.326,0.4,0.1388
1920,SBILIFE,SBI Life Insuran - Quaterly Results,2022/04/28,15:13,0.0,0.712,0.288,0.1581
1921,SBILIFE,SBI Life Insuran - Quaterly Results,2022/04/28,15:13,0.0,0.712,0.288,0.1581
1922,SBILIFE,SBI Life Insuran - Quaterly Results,2022/04/28,15:13,0.0,0.712,0.288,0.1581
1923,SBILIFE,SBI Life Insurance informs about certificate,2022/04/07,17:03,0.172,0.43,0.399,0.1489
1924,SBILIFE,Sbi Life Insurance Company informs about analyst meet,2022/03/26,12:02,0.246,0.209,0.546,0.2213
1925,SBILIFE,SBI Life Insurance Company informs about board meeting,2022/03/16,09:24,0.124,0.207,0.669,0.3137
1926,SBILIFE,SBI Life Insurance Company informs about board meeting,2022/03/15,16:56,0.124,0.207,0.669,0.3137
1927,SBILIFE,SBI Life Insuran - Quaterly Results,2022/01/21,15:08,0.0,0.712,0.288,0.1581
1928,SBILIFE,SBI Life Insurance Company informs about investor meet,2021/11/24,12:51,0.253,0.215,0.532,0.153
1929,SBILIFE,SBI Life Insurance Company informs about outcome of AGM,2021/09/25,11:44,0.217,0.293,0.49,0.2026
1930,SBILIFE,SBI Life Insurance Company informs about analyst meet,2021/09/22,09:48,0.246,0.209,0.546,0.2213
1931,SBILIFE,SBI Life Insurance Company informs about allotment of equity shares,2021/08/20,15:18,0.281,0.236,0.483,0.375
1932,SBILIFE,SBI Life Insurance Company informs about earnings conference call,2021/07/24,14:10,0.097,0.162,0.741,0.603
1933,SBILIFE,SBI Life Insurance Company informs about investor meeting ,2021/05/11,11:18,0.13,0.217,0.653,0.2085
1934,SBILIFE,SBI Life Insurance informs about investors meeting,2021/02/20,10:53,0.149,0.373,0.478,0.1661
1935,SBILIFE,SBI Life Insurance Company informs about outcome of board meeting,2021/01/22,15:12,0.188,0.17,0.642,0.3246
1936,SBILIFE,SBI Life Insurance Company acquires 9% stake in Paisalo Digital,2020/12/26,10:55,0.278,0.335,0.386,0.3155
1937,SBILIFE,SBI Life Insurance signs bancassurance agreement with Yes Bank,2020/09/22,09:12,0.173,0.23,0.597,0.674
1938,SBILIFE,SBI Life Insurance to hold board meeting,2020/07/09,16:57,0.385,0.12,0.496,0.2336
1939,SBILIFE,SBI Life Insurance Company informs about annual secretarial compliance report,2020/07/07,15:15,0.091,0.228,0.681,0.5788
1940,SBILIFE,SBI Life Insurance informs about compliance certificate,2020/04/17,14:56,0.142,0.356,0.502,0.2573
1941,SBIN,SBI raises $750 million under Global Medium Note programme,2023/05/29,18:06,0.455,0.416,0.13,-0.0333
1942,SBIN,SBI’s arm launches insurance product ‘General Surety Bond Bima’ ,2023/05/24,11:59,0.24,0.37,0.391,0.1607
1943,SBIN,SBI reports 84% rise in Q4 consolidated net profit ,2023/05/19,11:40,0.204,0.377,0.42,0.3178
1944,SBIN,SBI inks pact with Godrej Agrovet,2023/05/19,10:41,0.0,0.813,0.187,0.0381
1945,SBIN,State Bank Of India informs about record date,2023/05/18,16:14,0.347,0.225,0.428,0.1838
1946,SBIN,SBI - Quaterly Results,2023/05/18,13:42,0.0,1.0,0.0,0.0
1947,SBIN,SBI - Quaterly Results,2023/05/18,13:42,0.0,1.0,0.0,0.0
1948,SBIN,SBI - Quaterly Results,2023/05/18,13:42,0.0,1.0,0.0,0.0
1949,SBIN,SBI inks pact with Rukart,2023/05/09,18:16,0.0,0.777,0.223,0.0381
1950,SBIN,State Bank of India informs about updates,2023/05/03,14:54,0.28,0.404,0.316,0.0688
1951,SBIN,State Bank Of India informs about outcome of shareholders meeting,2023/04/28,15:11,0.293,0.284,0.424,0.0992
1952,SBIN,SBI raises $750 million through bonds to fund offshore business growth,2023/04/28,11:30,0.176,0.43,0.394,0.1395
1953,SBIN,SBI gets nod to raise $2 billion from bonds in FY24 ,2023/04/19,09:41,0.261,0.501,0.238,0.1847
1954,SBIN,State Bank of India re-launches retail term deposit scheme ‘Amrit Kalash’,2023/04/17,12:27,0.563,0.338,0.1,-0.1238
1955,SBIN,SBI planning for long term fund raising of up to $2 billion,2023/04/11,15:12,0.362,0.207,0.431,0.4604
1956,SBIN,State Bank of India informs about appointment of CS cum CO,2023/04/06,15:09,0.251,0.405,0.344,0.2838
1957,SBIN,SBI acquires 40% stake in Commercial Indo Bank LLC from Canara Bank,2023/03/24,14:06,0.306,0.354,0.34,0.3566
1958,SBIN,State Bank Of India informs about institutional investor,2023/03/18,11:48,0.237,0.228,0.535,0.1575
1959,SBIN,"SBI raises Rs 3,717 crore through third Basel III compliant Additional Tier 1 bond issuance",2023/03/09,09:42,0.336,0.486,0.178,-0.1506
1960,SBIN,State Bank Of India informs about updates ,2023/02/28,17:09,0.28,0.404,0.316,0.0688
1961,SBIN,SBI raises $1 billion from overseas markets  ,2023/02/28,16:08,0.291,0.547,0.163,0.016
1962,SBIN,State Bank Of India informs about investor interactions,2023/02/27,11:50,0.246,0.356,0.397,0.0701
1963,SBIN,State Bank of India partners with PayNow for cross-border payments,2023/02/23,11:08,0.199,0.479,0.322,0.0735
1964,SBIN,"SBI raises Rs 4,544 crore through bonds",2023/02/22,09:42,0.147,0.853,0.0,-0.0085
1965,SBIN,SBI opens third specialised branch for startups at Gurugram,2023/02/10,11:17,0.241,0.647,0.111,-0.0531
1966,SBIN,SBI reports 62% rise in Q3 consolidated net profit,2023/02/04,11:45,0.204,0.377,0.42,0.3178
1967,SBIN,SBI - Quaterly Results,2023/02/03,15:42,0.0,1.0,0.0,0.0
1968,SBIN,SBI - Quaterly Results,2023/02/03,15:42,0.0,1.0,0.0,0.0
1969,SBIN,SBI - Quaterly Results,2023/02/03,15:42,0.0,1.0,0.0,0.0
1970,SBIN,State Bank of India’s arm opens office in Bengaluru,2023/02/03,12:27,0.307,0.291,0.403,0.2484
1971,SBIN,SBI inks pact to acquire 40% stake in Commercial Indo Bank,2023/01/21,11:53,0.334,0.391,0.276,0.3093
1972,SBIN,"SBI raises Rs 9,718 crore through second infrastructure bond issuance",2023/01/19,09:39,0.216,0.534,0.249,0.0957
1973,SBIN,SBI inks MoU with Warehousing Development Regulatory Authority ,2023/01/17,14:57,0.0,0.54,0.46,0.3101
1974,SBIN,"SBI gets approval to raise up to Rs 10,000 crore via infrastructure bonds ",2023/01/03,15:30,0.19,0.373,0.437,0.6087
1975,SBIN,State Bank Of India informs about outcome of executive committee meeting ,2023/01/03,15:04,0.441,0.173,0.386,0.0936
1976,SBIN,"State Bank of India planning to raise upto Rs 10,000 crore through infrastructure bonds",2022/12/29,10:29,0.412,0.308,0.28,0.2183
1977,SBIN,"State Bank of India gets nod to raise AT1 Capital up to Rs 10,000 crore",2022/12/15,15:27,0.321,0.416,0.263,0.2583
1978,SBIN,State Bank of India planning to raise Additional Tier 1 Capital,2022/12/10,15:12,0.449,0.081,0.469,0.3066
1979,SBIN,State Bank Of India informs about analyst meeting ,2022/12/08,16:51,0.237,0.228,0.535,0.1581
1980,SBIN,SBI crosses Rs 5 lakh crore mark in personal banking advances excluding home loans,2022/12/06,11:09,0.224,0.561,0.215,0.2207
1981,SBIN,"SBI raises Rs 10,000 crore through infrastructure bond",2022/12/03,12:31,0.266,0.547,0.187,0.0709
1982,SBIN,"SBI gets nod to raise fund of Rs 10,000 crore in FY23",2022/11/29,15:07,0.242,0.544,0.214,0.1631
1983,SBIN,"State Bank of India planning to raise Rs 10,000 crore via infrastructure bonds",2022/11/25,11:09,0.356,0.337,0.307,0.312
1984,SBIN,SBI signs loan agreement with German development bank KfW,2022/11/17,10:30,0.299,0.237,0.464,0.475
1985,SBIN,State Bank of India reports 64% rise in Q2 consolidated net profit,2022/11/05,15:42,0.305,0.288,0.406,0.3409
1986,SBIN,State Bank Of India informs about press release,2022/11/05,15:27,0.221,0.213,0.565,0.3022
1987,SBIN,State Bank Of India informs about financial results,2022/11/05,15:21,0.245,0.354,0.401,0.0812
1988,SBIN,SBI - Quaterly Results,2022/11/05,13:34,0.0,1.0,0.0,0.0
1989,SBIN,SBI - Quaterly Results,2022/11/05,13:34,0.0,1.0,0.0,0.0
1990,SBIN,SBI - Quaterly Results,2022/11/05,13:34,0.0,1.0,0.0,0.0
1991,SUNPHARMA,Sun Pharma gets approval from China NMPA for NDA of tildrakizumab injection,2023/05/31,12:30,0.124,0.229,0.647,0.7994
1992,SUNPHARMA,Sun Pharmaceutical Industries enters into licensing agreement with Philogen,2023/05/30,12:00,0.16,0.222,0.618,0.7354
1993,SUNPHARMA,Sun Pharmaceutical planning to acquire Israel-based Taro Pharmaceutical Industries,2023/05/29,11:01,0.32,0.29,0.391,0.1862
1994,SUNPHARMA,Sun Pharmaceutical Industries informs about update ,2023/05/27,10:27,0.333,0.308,0.359,0.0444
1995,SUNPHARMA,Sun Pharmaceutical Industries informs about disclosure ,2023/05/27,10:25,0.177,0.307,0.516,0.0533
1996,SUNPHARMA,Sun Pharmaceutical Industries reports consolidated net profit of Rs 1984.47 crore in Q4 ,2023/05/26,17:17,0.219,0.403,0.378,0.3332
1997,SUNPHARMA,Sun Pharma Inds. - Quaterly Results,2023/05/26,14:47,0.18,0.467,0.353,0.2752
1998,SUNPHARMA,Sun Pharma Inds. - Quaterly Results,2023/05/26,14:47,0.18,0.467,0.353,0.2752
1999,SUNPHARMA,Sun Pharma Inds. - Quaterly Results,2023/05/26,14:47,0.18,0.467,0.353,0.2752
2000,SUNPHARMA,Sun Pharma recalls pre-filled syringes of Fyremadel injection in US market,2023/05/08,09:40,0.342,0.478,0.18,0.241
2001,SUNPHARMA,Sun Pharmaceutical launches novel ophthalmology treatment CEQUA in India,2023/04/25,14:50,0.195,0.347,0.458,0.4651
2002,SUNPHARMA,Sun Pharmaceutical Industries’ US-based arm recalls generic drug in US market,2023/04/24,10:38,0.252,0.307,0.441,0.3527
2003,SUNPHARMA,Sun Pharma inks pact to acquire 60% stake in Vivaldis Health and Foods,2023/03/25,11:02,0.198,0.305,0.497,0.5974
2004,SUNPHARMA,Sun Pharmaceutical Industries informs about loss of share certificates,2023/03/21,16:52,0.332,0.308,0.36,0.0682
2005,SUNPHARMA,Sun Pharmaceutical Industries informs about loss of share certificates,2023/03/17,17:06,0.332,0.308,0.36,0.0682
2006,SUNPHARMA,Sun Pharmaceutical Industries informs about analyst meet ,2023/03/14,11:30,0.292,0.252,0.456,0.0778
2007,SUNPHARMA,Sun Pharmaceutical Industries informs about loss of share certificates,2023/03/13,14:45,0.332,0.308,0.36,0.0682
2008,SUNPHARMA,Sun Pharmaceutical Industries informs about disclosure ,2023/03/08,15:23,0.177,0.307,0.516,0.0533
2009,SUNPHARMA,Sun Pharmaceutical Industries completes acquisition of Concert Pharmaceuticals ,2023/03/08,11:59,0.235,0.434,0.331,0.222
2010,SUNPHARMA,Sun Pharmaceutical Industries informs about analyst meet ,2023/03/03,16:57,0.292,0.252,0.456,0.0778
2011,SUNPHARMA,Sun Pharmaceutical Industries informs about disclosure ,2023/03/01,16:22,0.177,0.307,0.516,0.0533
2012,SUNPHARMA,"Sun Pharmaceutical Industries to acquire stakes in Agatsa Software, Remidio Innovative Solutions",2023/02/20,10:30,0.303,0.281,0.416,0.3838
2013,SUNPHARMA,Sun Pharmaceutical Industries informs about of issuance of duplicate share certificates,2023/02/18,12:34,0.273,0.428,0.3,0.0811
2014,SUNPHARMA,"Sun Pharma’s arm recalling over 34,000 bottles of generic medication in US",2023/02/13,11:28,0.343,0.457,0.2,0.0327
2015,SUNPHARMA,Sun Pharmaceutical Industries informs about press release ,2023/02/10,12:54,0.137,0.237,0.626,0.2814
2016,SUNPHARMA,Sun Pharma’s arm receives USFDA’s approval for Generic Lenalidomide Capsules,2023/02/10,12:12,0.097,0.42,0.482,0.3785
2017,SUNPHARMA,Sun Pharmaceutical Industries informs about analyst meet,2023/02/03,17:15,0.292,0.252,0.456,0.0778
2018,SUNPHARMA,Sun Pharmaceutical Industries informs about audio recording of call,2023/02/01,09:34,0.222,0.409,0.369,0.1105
2019,SUNPHARMA,Sun Pharmaceutical Industries reports marginal rise in Q3 consolidated net profit,2023/01/31,15:20,0.256,0.309,0.435,0.3209
2020,SUNPHARMA,Sun Pharma Inds. - Quaterly Results,2023/01/31,13:28,0.18,0.467,0.353,0.2752
2021,SUNPHARMA,Sun Pharma Inds. - Quaterly Results,2023/01/31,13:28,0.18,0.467,0.353,0.2752
2022,SUNPHARMA,Sun Pharma Inds. - Quaterly Results,2023/01/31,13:28,0.18,0.467,0.353,0.2752
2023,SUNPHARMA,Sun Pharma acquires three anti-inflammatory brands from Aksigen Hospital Care,2023/01/30,14:30,0.083,0.359,0.558,0.6833
2024,SUNPHARMA,Sun Pharmaceutical Industries informs about outcome of postal ballot ,2023/01/28,12:38,0.227,0.418,0.355,0.058
2025,SUNPHARMA,Sun Pharmaceutical Industries informs about loss of share certificates,2023/01/27,17:11,0.332,0.308,0.36,0.0682
2026,SUNPHARMA,Sun Pharmaceutical Industries launches SEZABY in U.S.,2023/01/25,15:17,0.5,0.36,0.14,-0.2482
2027,SUNPHARMA,Sun Pharma to acquire Concert Pharmaceuticals ,2023/01/20,10:08,0.266,0.246,0.488,0.4229
2028,SUNPHARMA,USFDA pulls up Sun Pharma for manufacturing lapses in Halol plant,2023/01/14,15:41,0.36,0.288,0.352,0.2246
2029,SUNPHARMA,Sun Pharmaceutical Industries launches Palbociclib in India,2023/01/11,12:14,0.303,0.54,0.158,-0.0191
2030,SUNPHARMA,Sun Pharmaceutical Industries informs about newspaper advertisements ,2022/12/26,16:44,0.154,0.535,0.311,0.0452
2031,SUNPHARMA,Sun Pharmaceutical Industries informs about sustainability report,2022/12/24,11:59,0.145,0.376,0.48,0.1723
2032,SUNPHARMA,Sun Pharma receives warning letter from USFDA for Halol facility,2022/12/17,16:13,0.235,0.202,0.563,0.4364
2033,SUNPHARMA,Sun Pharmaceutical Industries informs about updates,2022/12/08,17:14,0.178,0.463,0.359,0.0452
2034,SUNPHARMA,USFDA lists Sun Pharma's Halol facility under import alert,2022/12/08,12:07,0.343,0.407,0.249,0.0193
2035,SUNPHARMA,"Sun Pharma’s US-based unit recalls 14,064 cartons of medication to treat erosive esophagitis",2022/12/05,11:17,0.217,0.546,0.237,0.3163
2036,SUNPHARMA,Sun Pharmaceutical Industries informs about loss of share certificates,2022/12/02,11:10,0.332,0.308,0.36,0.0682
2037,SUNPHARMA,"Sun Pharma, SPARC get nod from USFDA for SEZABY ",2022/11/18,14:09,0.108,0.375,0.517,0.3322
2038,SUNPHARMA,Sun Pharmaceutical Industries informs about press release,2022/11/18,10:28,0.137,0.237,0.626,0.2814
2039,SUNPHARMA,Sun Pharmaceutical Industries informs about press release,2022/11/09,16:09,0.137,0.237,0.626,0.2814
2040,SUNPHARMA,"Sun Pharma, SPARC enter into license agreement for commercialization of phenobarbital for injection in US",2022/11/09,13:01,0.277,0.259,0.465,0.6844
2041,TCS,Ikano Bank selects TCS BaNCS for panEurope core banking transformation,2023/05/30,12:59,0.202,0.583,0.214,0.0321
2042,TCS,TCS recognized as leader in Everest Group’s PEAK Matrix for IPA solutions,2023/05/25,16:45,0.206,0.405,0.39,0.1844
2043,TCS,TCS positioned as Market Leader in Digital Engineering by HFS Research,2023/05/24,16:40,0.324,0.23,0.446,0.3796
2044,TCS,Zurich DIFC transforms business operations with TCS BaNCS,2023/05/23,14:58,0.0,0.736,0.264,0.0386
2045,TCS,Tata Consultancy Services informs about press release,2023/05/23,14:33,0.0,0.493,0.507,0.2782
2046,TCS,Tata Consultancy Services informs about press release,2023/05/23,11:26,0.0,0.493,0.507,0.2782
2047,TCS,TCS enters into partnership with Jaguar Land Rover ,2023/05/23,10:28,0.201,0.39,0.409,0.4819
2048,TCS,"TCS recognized as leader for worldwide manufacturing intelligence transformation, strategic consulting ",2023/05/22,16:50,0.085,0.246,0.669,0.759
2049,TCS,TCS expands partnership with Google Cloud,2023/05/22,14:30,0.145,0.225,0.63,0.5115
2050,TCS,Tata Consultancy Services informs about press release,2023/05/22,13:10,0.0,0.493,0.507,0.2782
2051,TCS,"TCS lays foundation for Versuni to become digital-first, insights-led company",2023/05/22,11:29,0.211,0.468,0.321,0.0438
2052,TCS,"TCS-led consortium receives advance purchase order worth Rs 15,000 crore",2023/05/22,09:38,0.0,0.466,0.534,0.5955
2053,TCS,Tata Consultancy Services informs about disclosure ,2023/05/22,09:35,0.0,0.646,0.354,0.0497
2054,TCS,TCS recognized as leader in Everest Group PEAK Matrix for AA&I services,2023/05/19,12:23,0.206,0.405,0.389,0.1818
2055,TCS,TCS recognized as leader for life sciences sales and marketing strategic consulting services,2023/05/17,16:28,0.0,0.373,0.627,0.6245
2056,TCS,Tata Consultancy Services informs about press release,2023/05/16,17:07,0.0,0.493,0.507,0.2782
2057,TCS,TCS ranked number one IT service provider for customer satisfaction in UK,2023/05/12,12:11,0.139,0.113,0.748,0.7781
2058,TCS,TCS recognized as leader for Asia/Pacific Intelligent Digital Workplace Services,2023/05/03,10:23,0.079,0.382,0.54,0.6176
2059,TCS,Tata Consultancy Services informs about press release ,2023/04/25,16:27,0.0,0.493,0.507,0.2782
2060,TCS,TCS extends partnership with Marks and Spencer plc,2023/04/25,11:58,0.0,0.371,0.629,0.5815
2061,TCS,TCS recognized as leader in Capital Markets Operations by Everest Group ,2023/04/20,16:45,0.182,0.38,0.439,0.3367
2062,TCS,TCS features as market leader among healthcare payer service providers,2023/04/18,16:27,0.083,0.319,0.598,0.5349
2063,TCS,TCS extends partnership with Canberra Times Marathon for another three years,2023/04/17,15:27,0.0,0.432,0.568,0.598
2064,TCS,"TCS to continue investing in research & innovation, office spaces, tech infra",2023/04/17,11:12,0.333,0.226,0.441,0.3461
2065,TCS,TCS reports 15% rise in Q4 consolidated net profit,2023/04/12,17:56,0.204,0.377,0.42,0.3178
2066,TCS,TCS - Quaterly Results,2023/04/12,17:20,0.0,1.0,0.0,0.0
2067,TCS,TCS - Quaterly Results,2023/04/12,17:20,0.0,1.0,0.0,0.0
2068,TCS,TCS - Quaterly Results,2023/04/12,17:20,0.0,1.0,0.0,0.0
2069,TCS,TCS recognized as leader for Outsourced Digital Workplace Services,2023/04/06,17:13,0.102,0.495,0.403,0.2596
2070,TCS,"TCS selected by Bane NOR to strengthen identity, access management across digital landscape",2023/04/03,12:48,0.277,0.339,0.384,0.375
2071,TCS,TCS positioned as leader in NelsonHall NEAT ,2023/03/30,14:55,0.442,0.221,0.337,0.0116
2072,TCS,Tata Consultancy Services informs about press release,2023/03/30,14:08,0.0,0.493,0.507,0.2782
2073,TCS,TCS named leader for software product engineering services,2023/03/28,17:19,0.116,0.434,0.45,0.2676
2074,TCS,TCS ranked number one for customer satisfaction in Europe,2023/03/27,16:17,0.283,0.161,0.556,0.5263
2075,TCS,Tata Consultancy Services informs about press release,2023/03/15,12:55,0.0,0.493,0.507,0.2782
2076,TCS,Tata Consultancy Services partners with Envestnet,2023/03/15,12:46,0.0,0.813,0.187,0.0381
2077,TCS,Tata Consultancy Services informs about press release,2023/03/14,12:45,0.0,0.493,0.507,0.2782
2078,TCS,TCS launches 5G-enabled Cognitive Plant Operations Adviser ,2023/03/14,11:20,0.185,0.815,0.0,-0.0938
2079,TCS,TCS debuts on Forbes list of America’s best large employers,2023/03/13,12:41,0.088,0.435,0.477,0.3554
2080,TCS,"Tata Consultancy Services recognized as Top Employer in the UAE, Saudi Arabia, South Africa",2023/03/06,12:37,0.39,0.447,0.163,-0.4698
2081,TCS,Tata Consultancy Services informs about press release,2023/03/06,11:46,0.0,0.493,0.507,0.2782
2082,TCS,TCS recognized as leader in Everest Group’s PEAK Matrix for procurement outsourcing,2023/02/27,16:17,0.216,0.496,0.288,0.0068
2083,TCS,TCS positioned as leader in Everest Group’s PEAK Matrix for Open Finance IT Services,2023/02/25,10:38,0.305,0.289,0.406,0.1875
2084,TCS,Tata Consultancy Services informs about press release,2023/02/24,16:32,0.0,0.493,0.507,0.2782
2085,TCS,Tata Consultancy Services informs about press release,2023/02/24,16:32,0.0,0.493,0.507,0.2782
2086,TCS,TCS expands long-standing partnership with Phoenix Group,2023/02/22,10:29,0.0,0.292,0.708,0.6464
2087,TCS,TCS recognized as leader in the IDC MarketScape  ,2023/02/20,16:57,0.232,0.436,0.332,0.2308
2088,TCS,TCS partners with Telefonica Germany,2023/02/20,12:42,0.234,0.554,0.212,-0.0308
2089,TCS,Tata Consultancy Services informs about press release,2023/02/20,12:40,0.0,0.493,0.507,0.2782
2090,TCS,Tata Consultancy Services informs about loss of share certificates,2023/02/18,12:05,0.221,0.531,0.248,0.0646
2091,TATASTEEL,Tata Steel’s arm partners with METRON to reduce carbon footprint,2023/05/31,15:57,0.196,0.441,0.362,0.221
2092,TATASTEEL,Tata Steel informs about disclosure ,2023/05/23,11:23,0.0,0.356,0.644,0.1593
2093,TATASTEEL,Tata Steel informs about audio / video recording of earning discussion,2023/05/04,10:27,0.388,0.371,0.241,0.1062
2094,TATASTEEL,Tata Steel reports 84% fall in Q4 consolidated net profit,2023/05/03,10:30,0.21,0.319,0.471,0.31
2095,TATASTEEL,Tata Steel - Quaterly Results,2023/05/02,18:37,0.0,0.677,0.323,0.1109
2096,TATASTEEL,Tata Steel - Quaterly Results,2023/05/02,18:37,0.0,0.677,0.323,0.1109
2097,TATASTEEL,Tata Steel signs business cooperation agreement with MN Dastur & Company ,2023/04/28,12:46,0.147,0.278,0.575,0.4859
2098,TATASTEEL,Tata Steel inks business cooperation agreement with A&B Global Mining,2023/04/28,11:22,0.089,0.3,0.611,0.6063
2099,TATASTEEL,Tata Steel initiates trial for hydrogen gas injection in blast furnace at Jamshedpur Works,2023/04/25,10:59,0.114,0.38,0.506,0.7358
2100,TATASTEEL,Tata Steel informs about analyst meet ,2023/04/20,11:37,0.164,0.284,0.551,0.1829
2101,TATASTEEL,Tata Steel recognized as steel sustainability champion by World Steel Association,2023/04/19,10:10,0.066,0.26,0.674,0.7464
2102,TATASTEEL,Tata steel informs about board meeting intimation,2023/04/15,16:43,0.0,0.369,0.631,0.278
2103,TATASTEEL,Tata Steel reports 3% rise in steel production during Q4FY23,2023/04/06,09:42,0.186,0.344,0.47,0.3169
2104,TATASTEEL,Tata Steel acquires additional stake in TSUISL,2023/03/27,11:59,0.125,0.345,0.529,0.3638
2105,TATASTEEL,Tata Steel recognized as 2022 ‘Supplier Engagement Leader’ by CDP,2023/03/24,12:28,0.0,0.477,0.523,0.5557
2106,TATASTEEL,Tata Steel acquires balance stake in Tata Steel Advanced Materials,2023/03/24,10:21,0.173,0.33,0.497,0.4444
2107,TATASTEEL,Tata Steel informs about closure of trading window ,2023/03/23,16:09,0.24,0.219,0.541,0.1892
2108,TATASTEEL,Tata Steel inks MoU with Ministry of Steel under PLI Scheme,2023/03/18,16:17,0.272,0.404,0.324,0.1631
2109,TATASTEEL,Tata Steel informs about conversion of securities,2023/03/18,11:56,0.115,0.34,0.544,0.4168
2110,TATASTEEL,Tata Steel acquires stake in TSAML,2023/03/18,10:40,0.148,0.409,0.443,0.2872
2111,TATASTEEL,Tata Steel gets 5-Star ratings for two mines for sustainable development ,2023/03/08,15:49,0.132,0.486,0.382,0.0237
2112,TATASTEEL,Tata Steel acquires stake in TRF on private placement basis,2023/03/02,09:30,0.092,0.254,0.654,0.3925
2113,TATASTEEL,Tata Steel raises Rs 2150 crore through NCDs,2023/02/28,09:26,0.122,0.709,0.169,0.1026
2114,TATASTEEL,Tata Steel acquires additional stake in Neelachal Ispat Nigam,2023/02/23,09:22,0.102,0.468,0.43,0.3638
2115,TATASTEEL,Tata Steel gets nod to raise Rs 2150 crore through NCDs,2023/02/21,11:38,0.168,0.577,0.255,0.2627
2116,TATASTEEL,Tata Steel completes first multi-modal shipment of TMT bars to Tripura,2023/02/17,10:30,0.359,0.517,0.123,0.0677
2117,TATASTEEL,Tata Steel signs MoU with Central Building Research Institute ,2023/02/16,18:07,0.131,0.341,0.528,0.392
2118,TATASTEEL,Tata Steel featured among Top 50 India’s Best Workplaces in Manufacturing 2023 ,2023/02/13,11:07,0.312,0.415,0.272,-0.1468
2119,TATASTEEL,UK government offers counter-package to Tata Steel for Port Talbot plant,2023/02/09,12:38,0.245,0.274,0.481,0.5333
2120,TATASTEEL,Tata Steel reports consolidated net loss of Rs 2501.95 crore in Q3 ,2023/02/07,10:28,0.227,0.429,0.345,0.3919
2121,TATASTEEL,Tata Steel - Quaterly Results,2023/02/06,18:22,0.0,0.677,0.323,0.1109
2122,TATASTEEL,Tata Steel - Quaterly Results,2023/02/06,18:22,0.0,0.677,0.323,0.1109
2123,TATASTEEL,Tata Steel - Quaterly Results,2023/02/06,18:22,0.0,0.677,0.323,0.1109
2124,TATASTEEL,Tata Steel sets up innovation centre for mining and mineral research at IIT (ISM) Dhanbad,2023/02/06,15:29,0.129,0.337,0.534,0.497
2125,TATASTEEL,Tata Steel acquires additional stake in TSUISL ,2023/02/02,09:27,0.125,0.345,0.529,0.3638
2126,TATASTEEL,Tata Steel recognized as global diversity equity & inclusion lighthouse 2023 ,2023/01/30,09:42,0.23,0.541,0.229,-0.0013
2127,TATASTEEL,Tata Steel completes CargoDocs eB/L transaction for imports into Turkey,2023/01/21,14:38,0.179,0.433,0.389,0.3456
2128,TATASTEEL,Tata Steel sets up Centre for Innovation in Mobility at IIT Madras Research Park,2023/01/17,10:39,0.199,0.353,0.448,0.4975
2129,TATASTEEL,Tata Steel informs about disclosure ,2023/01/16,12:08,0.0,0.356,0.644,0.1593
2130,TATASTEEL,Tata Steel informs about board meeting,2023/01/12,17:44,0.0,0.281,0.719,0.278
2131,TATASTEEL,Tata Steel informs about press release,2023/01/07,11:44,0.0,0.265,0.735,0.3724
2132,TATASTEEL,Tata Steel's Indian business reports 4% growth in crude steel production in Q3FY23,2023/01/07,11:15,0.308,0.338,0.354,0.1716
2133,TATASTEEL,Tata Steel acquires stake in Tata Steel Advanced Materials,2022/12/29,10:11,0.098,0.36,0.542,0.4473
2134,TATASTEEL,Tata Steel inks MoA with TuTr Hyperloop to develop and deploy Hyperloop technology,2022/12/27,15:45,0.239,0.412,0.349,0.1523
2135,TATASTEEL,Tata Steel certified as ‘Great Place to Work’ for sixth consecutive time,2022/12/27,11:29,0.26,0.384,0.356,0.0649
2136,TATASTEEL,Tata Steel gets BIS license for Jamshedpur plant to produce structural weather resistant steel ,2022/12/23,16:45,0.22,0.313,0.467,0.2396
2137,TATASTEEL,Tata Steel informs about trading window closure,2022/12/22,15:33,0.145,0.246,0.609,0.1935
2138,TATASTEEL,Tata Steel executes implosion of two obsolete coke plant facilities,2022/12/19,16:57,0.324,0.421,0.255,0.0447
2139,TATASTEEL,Tata Steel informs about loss of share certificate ,2022/12/07,12:31,0.236,0.339,0.426,0.1737
2140,TATASTEEL,Tata Steel informs about analyst meet,2022/11/28,10:47,0.164,0.284,0.551,0.1829
2141,TATACONSUM,Tata Consumer Products expanding presence in southern markets of India,2023/05/30,12:46,0.208,0.691,0.101,-0.0213
2142,TATACONSUM,Tata Consumer Products informs about AGM,2023/04/25,16:53,0.0,0.647,0.353,0.0474
2143,TATACONSUM,Tata Consumer Produc - Quaterly Results,2023/04/25,16:12,0.0,0.796,0.204,0.0059
