,Ticker,Headline,Date,Time,neg,neu,pos,compound
1189,HINDUNILVR,Hindustan Unilever informs about proceedings of AGM,2022/06/24,09:44,0.142,0.697,0.162,0.037
1190,HINDUNILVR,Hindustan Unilever informs about 89th AGM,2022/06/23,16:13,0.0,0.812,0.188,0.0415
1191,HINDUNILVR,Hindustan Unilever informs about loss of share certificate,2022/06/17,10:17,0.248,0.475,0.277,0.0646
1192,HINDUNILVR,Hindustan Unilever informs about integrated annual report,2022/05/28,11:45,0.0,0.459,0.541,0.404
1193,HINDUNILVR,Hindustan Unilever informs about loss of share certificate,2022/05/21,12:15,0.248,0.475,0.277,0.0646
1194,HINDUNILVR,Hindustan Unilever informs about newspaper advertisements ,2022/05/21,12:12,0.0,0.812,0.188,0.0415
1195,HINDUNILVR,Hindustan Unilever reports marginal rise in Q4 consolidated net profit,2022/04/27,17:16,0.186,0.43,0.384,0.3178
1196,HINDUNILVR,Hindustan Unilever - Quaterly Results,2022/04/27,16:08,0.0,1.0,0.0,0.0
1197,HINDUNILVR,Hindustan Unilever - Quaterly Results,2022/04/27,16:08,0.0,1.0,0.0,0.0
1198,HINDUNILVR,Hindustan Unilever - Quaterly Results,2022/04/27,16:08,0.0,1.0,0.0,0.0
1199,HINDUNILVR,Hindustan Unilever informs about loss of share certificates,2022/04/27,12:05,0.248,0.475,0.277,0.0646
1200,ICICIBANK,ICICI Bank gets nod to increase shareholding in ICICI Lombard General Insurance,2023/05/29,12:11,0.34,0.468,0.192,0.0261
1201,ICICIBANK,ICICI Bank informs about loss of share certificate,2023/05/20,15:51,0.371,0.354,0.275,0.0497
1202,ICICIBANK,ICICI Bank informs about allotment of equity shares under ESOS,2023/05/17,17:10,0.384,0.335,0.281,0.1977
1203,ICICIBANK,ICICI Bank informs about loss of share certificates,2023/05/06,10:41,0.371,0.354,0.275,0.0497
1204,ICICIBANK,ICICI Bank informs about allotment under ESOP,2023/05/05,14:51,0.298,0.544,0.158,-0.0088
1205,ICICIBANK,ICICI Bank introduces auto recharge on FASTag through UPI mandate,2023/05/05,11:12,0.307,0.587,0.106,-0.0134
1206,ICICIBANK,ICICI Bank informs about allotment of equity shares under ESOS,2023/05/03,13:11,0.384,0.335,0.281,0.1977
1207,ICICIBANK,ICICI Bank informs about loss of share certificate,2023/04/28,17:00,0.371,0.354,0.275,0.0497
1208,ICICIBANK,ICICI Bank offers strong network of Rupee Vostro Accounts,2023/04/28,11:08,0.156,0.377,0.467,0.7286
1209,ICICIBANK,ICICI Bank informs about transcripts of earnings call ,2023/04/28,10:48,0.237,0.342,0.421,0.1567
1210,ICICIBANK,ICICI Bank gets nod to raise Rs 250 billion through NCDs,2023/04/24,11:50,0.35,0.509,0.141,0.1371
1211,ICICIBANK,ICICI Bank reports 28% rise in Q4 consolidated net profit,2023/04/24,11:12,0.276,0.342,0.382,0.305
1212,ICICIBANK,ICICI Bank - Quaterly Results,2023/04/22,15:42,0.261,0.739,0.0,-0.015
1213,ICICIBANK,ICICI Bank - Quaterly Results,2023/04/22,15:42,0.261,0.739,0.0,-0.015
1214,ICICIBANK,ICICI Bank - Quaterly Results,2023/04/22,15:42,0.261,0.739,0.0,-0.015
1215,ICICIBANK,ICICI Bank informs about loss of share certificates,2023/04/22,11:51,0.371,0.354,0.275,0.0497
1216,ICICIBANK,Icici Bank informs about allotment of equity shares under ESOP ,2023/04/21,16:36,0.384,0.335,0.281,0.1977
1217,ICICIBANK,ICICI Bank informs about loss of share certificate,2023/04/21,15:31,0.371,0.354,0.275,0.0497
1218,ICICIBANK,ICICI Bank enables FASTag based parking payment at Mangaluru International Airport,2023/04/19,11:38,0.164,0.553,0.283,0.363
1219,ICICIBANK,ICICI Bank informs about details of loss of certificate ,2023/04/17,12:34,0.446,0.429,0.125,0.0001
1220,ICICIBANK,ICICI Bank launches EMI facility for UPI payments by scanning QR code,2023/04/12,10:39,0.169,0.563,0.268,0.0589
1221,ICICIBANK,ICICI Bank informs about loss of share certificates ,2023/04/05,16:51,0.371,0.354,0.275,0.0497
1222,ICICIBANK,ICICI Bank informs about board meeting ,2023/03/24,15:52,0.157,0.296,0.547,0.1608
1223,ICICIBANK,Icici Bank informs about allotment under ESOP,2023/03/17,15:13,0.298,0.544,0.158,-0.0088
1224,ICICIBANK,ICICI Bank informs about appointment of CS cum CO,2023/03/16,12:48,0.205,0.493,0.302,0.2458
1225,ICICIBANK,"ICICI Bank offers bouquet of digital, physical solutions for startups",2023/03/15,11:59,0.272,0.351,0.377,0.2935
1226,ICICIBANK,ICICI Bank informs about investor meet,2023/03/14,17:18,0.347,0.313,0.339,-0.0126
1227,ICICIBANK,Icici Bank informs about loss of share certificate,2023/03/13,15:24,0.371,0.354,0.275,0.0497
1228,ICICIBANK,ICICI Bank gets time extension to divest stake in ICICI Lombard General Insurance ,2023/03/13,11:53,0.373,0.347,0.279,0.1649
1229,ICICIBANK,Icici Bank informs about allotment under ESOS,2023/03/03,13:17,0.298,0.544,0.158,-0.0088
1230,ICICIBANK,ICICI Bank launches digital solutions for participants of capital market,2023/03/03,10:29,0.487,0.268,0.244,0.0723
1231,ICICIBANK,ICICI Bank informs about details of loss of certificate,2023/02/28,16:18,0.446,0.429,0.125,0.0001
1232,ICICIBANK,ICICI Bank informs about allotment of equity shares,2023/02/24,16:56,0.351,0.306,0.343,0.2307
1233,ICICIBANK,ICICI Bank informs about disclosure ,2023/02/18,15:38,0.201,0.381,0.418,0.0347
1234,ICICIBANK,ICICI Bank informs about allotment of equity shares under ESOS ,2023/02/17,13:16,0.384,0.335,0.281,0.1977
1235,ICICIBANK,ICICI Bank signs MoU with BNP Paribas,2023/02/14,17:06,0.45,0.427,0.123,-0.4706
1236,ICICIBANK,Icici Bank informs about allotment of equity shares under ESOS,2023/02/14,13:27,0.384,0.335,0.281,0.1977
1237,ICICIBANK,ICICI Bank informs about details of loss of certificate ,2023/02/13,15:24,0.446,0.429,0.125,0.0001
1238,ICICIBANK,Icici Bank informs about loss of share certificate,2023/02/04,15:55,0.371,0.354,0.275,0.0497
1239,ICICIBANK,ICICI Bank informs about allotment of equity shares ,2023/02/03,10:58,0.351,0.306,0.343,0.2307
1240,ICICIBANK,ICICI Bank informs about allotment of equity shares under ESOS,2023/01/31,12:52,0.384,0.335,0.281,0.1977
1241,ICICIBANK,ICICI Bank inks pact with Tata Motors,2023/01/24,11:51,0.147,0.694,0.159,0.0232
1242,ICICIBANK,ICICI Bank reports 35% rise in Q3 consolidated net profit,2023/01/21,17:45,0.276,0.342,0.382,0.305
1243,ICICIBANK,ICICI Bank - Quaterly Results,2023/01/21,15:58,0.261,0.739,0.0,-0.015
1244,ICICIBANK,ICICI Bank - Quaterly Results,2023/01/21,15:58,0.261,0.739,0.0,-0.015
1245,ICICIBANK,ICICI Bank - Quaterly Results,2023/01/21,15:58,0.261,0.739,0.0,-0.015
1246,ICICIBANK,Societe Generale buys shares worth over Rs 173 crore of ICICI Bank,2023/01/12,11:18,0.239,0.504,0.257,0.3088
1247,ICICIBANK,ICICI Bank launches digital solutions for exporters,2023/01/06,16:50,0.267,0.384,0.349,0.1634
1248,ICICIBANK,ICICI Bank informs about allotment of equity shares under ESOS ,2022/12/27,16:25,0.384,0.335,0.281,0.1977
1249,ICICIBANK,ICICI Bank informs about details of loss of certificate ,2022/12/26,12:53,0.446,0.429,0.125,0.0001
1250,INFY,Infosys collaborates with Adobe,2023/05/24,15:58,0.254,0.474,0.272,0.0202
1251,INFY,"Infosys launches AI-first set of services, solutions, platforms ‘Infosys Topaz’",2023/05/23,16:12,0.091,0.629,0.279,0.271
1252,INFY,Infosys informs about press release,2023/05/17,16:52,0.0,0.327,0.673,0.2782
1253,INFY,Infosys recognized as number one service provider across UK,2023/05/17,13:00,0.086,0.171,0.742,0.5668
1254,INFY,Infosys inks memorandum of understanding with bp,2023/05/16,16:30,0.138,0.541,0.322,0.0933
1255,INFY,Infosys positioned as leader in two reports by Independent Research Firm,2023/05/09,16:30,0.139,0.195,0.666,0.7273
1256,INFY,"Infosys, SolarWinds collaborate to advance shift of SolarWinds solutions to new SaaS model",2023/05/03,10:13,0.357,0.341,0.302,0.2963
1257,INFY,Infosys informs about press release,2023/05/02,15:03,0.0,0.327,0.673,0.2782
1258,INFY,Infosys collaborates with Walmart Commerce Technologies,2023/04/27,10:03,0.0,0.569,0.431,0.2557
1259,INFY,Infosys extends collaboration with Brent Council,2023/04/26,12:19,0.16,0.446,0.394,0.1469
1260,INFY,Infosys collaborates with ServiceNow,2023/04/25,14:22,0.0,0.723,0.277,0.0381
1261,INFY,Infosys informs about press release,2023/04/24,16:37,0.0,0.327,0.673,0.2782
1262,INFY,Infosys signs MoU with Aramco,2023/04/24,16:13,0.0,0.777,0.223,0.0381
1263,INFY,Infosys Finacle powers XacBank’s digital transformation journey,2023/04/20,12:30,0.147,0.853,0.0,-0.0083
1264,INFY,Infosys recognized as launch partner for AWS Cloud Operations ,2023/04/18,11:59,0.112,0.35,0.538,0.4351
1265,INFY,Infosys informs about RPT,2023/04/14,13:01,0.0,0.401,0.599,0.2485
1266,INFY,Infosys reports 8% rise in Q4 consolidated net profit,2023/04/13,17:54,0.204,0.377,0.42,0.3178
1267,INFY,Infosys - Quaterly Results,2023/04/13,16:09,0.0,1.0,0.0,0.0
1268,INFY,Infosys - Quaterly Results,2023/04/13,16:09,0.0,1.0,0.0,0.0
1269,INFY,Infosys - Quaterly Results,2023/04/13,16:09,0.0,1.0,0.0,0.0
1270,INFY,Infosys extends collaboration with LexisNexis,2023/04/05,16:16,0.0,0.531,0.469,0.165
1271,INFY,Infosys informs about press release,2023/04/04,16:33,0.0,0.327,0.673,0.2782
1272,INFY,"Infosys’ arm, UNDP successfully deploy UNDP’s Quantum Global Digital Management System",2023/03/24,12:21,0.474,0.324,0.203,-0.0901
1273,INFY,Infosys informs about press release,2023/03/23,15:56,0.0,0.327,0.673,0.2782
1274,INFY,Infosys informs about press release,2023/03/17,17:10,0.0,0.327,0.673,0.2782
1275,INFY,Infosys partners with Sandwell Council to launch Springboard digital learning platform,2023/03/17,15:59,0.257,0.413,0.33,0.2209
1276,INFY,Infosys informs about press release,2023/03/15,15:18,0.0,0.327,0.673,0.2782
1277,INFY,Infosys informs about board meeting ,2023/03/14,10:00,0.0,0.352,0.648,0.1751
1278,INFY,Infosys recognized as one of 2023 World’s most ethical companies by Ethisphere,2023/03/13,17:22,0.067,0.464,0.469,0.6187
1279,INFY,Infosys informs about press release,2023/03/09,17:02,0.0,0.327,0.673,0.2782
1280,INFY,Infosys collaborates with mobility specialist ZF,2023/03/09,16:00,0.0,0.813,0.187,0.0381
1281,INFY,Infosys informs about press release,2023/03/08,12:08,0.0,0.327,0.673,0.2782
1282,INFY,Infosys leads global ESG rankings ,2023/03/02,17:21,0.228,0.772,0.0,-0.047
1283,INFY,Infosys informs about disclosure,2023/03/02,17:05,0.0,0.477,0.523,0.0497
1284,INFY,Infosys informs about press release,2023/03/01,14:24,0.0,0.327,0.673,0.2782
1285,INFY,Infosys inks MoU with Motherhood Hospitals,2023/03/01,12:08,0.0,0.813,0.187,0.0381
1286,INFY,Infosys informs about notice of postal ballot,2023/02/28,16:52,0.139,0.545,0.316,0.0767
1287,INFY,Infosys enters into strategic collaboration with ng-voice ,2023/02/28,14:21,0.127,0.504,0.369,0.2299
1288,INFY,Infosys rolls out private 5G-as-a-service to accelerate business value for enterprises,2023/02/28,10:39,0.185,0.342,0.473,0.0944
1289,INFY,Infosys informs about press release,2023/02/27,16:59,0.0,0.327,0.673,0.2782
1290,INFY,Infosys informs about press release,2023/02/23,17:04,0.0,0.327,0.673,0.2782
1291,INFY,Infosys collaborates with Microsoft to accelerate industry adoption of cloud,2023/02/23,15:36,0.385,0.345,0.269,0.1672
1292,INFY,Infosys informs about press release,2023/02/17,17:11,0.0,0.327,0.673,0.2782
1293,INFY,Infosys informs about press release,2023/02/15,16:36,0.0,0.327,0.673,0.2782
1294,INFY,Infosys positioned as leader for Digital Workplace Services in North America,2023/02/15,16:15,0.298,0.211,0.491,0.5764
1295,INFY,Infosys informs about press release,2023/02/15,14:49,0.0,0.327,0.673,0.2782
1296,INFY,Infosys positioned as highest leader for WCC Service Provider 2023 ,2023/02/15,11:20,0.18,0.256,0.564,0.3629
1297,INFY,Infosys informs about press release,2023/02/14,16:37,0.0,0.327,0.673,0.2782
1298,INFY,Infosys’ CSR arm collaborates with Health Department of Karnataka ,2023/02/13,11:20,0.107,0.528,0.365,0.113
1299,INFY,Infosys informs about press release,2023/02/13,09:43,0.0,0.327,0.673,0.2782
1300,ITC,"ITC inaugurates consumer goods manufacturing, logistics facility in Odisha",2023/05/23,09:48,0.365,0.404,0.231,-0.0846
1301,ITC,ITC reports 23% rise in Q4 consolidated net profit ,2023/05/18,15:58,0.204,0.377,0.42,0.3178
1302,ITC,ITC - Quaterly Results,2023/05/18,14:49,0.0,1.0,0.0,0.0
1303,ITC,ITC - Quaterly Results,2023/05/18,14:49,0.0,1.0,0.0,0.0
1304,ITC,ITC - Quaterly Results,2023/05/18,14:49,0.0,1.0,0.0,0.0
1305,ITC,ITC informs about secretarial compliance report,2023/05/09,17:21,0.0,0.422,0.578,0.2758
1306,ITC,ITC’s hospitality arm signs three more properties under Storii brand	,2023/05/09,14:41,0.109,0.669,0.223,0.0502
1307,ITC,ITC informs about disclosure,2023/05/05,15:56,0.0,0.477,0.523,0.0497
1308,ITC,ITC acquires stake in Sproutlife Foods,2023/05/05,14:54,0.158,0.579,0.263,0.185
1309,ITC, ITC informs about disclosure ,2023/05/03,14:07,0.0,0.477,0.523,0.0497
1310,ITC,ITC inks pact to acquire 100% stake in Sproutlife Foods,2023/04/20,09:59,0.181,0.516,0.303,0.3459
1311,ITC,ITC’s arm incorporates wholly owned subsidiary,2023/04/19,14:14,0.0,0.828,0.172,0.0098
1312,ITC,ITC divests entire stake of Espirit Hotels,2023/04/08,10:57,0.127,0.5,0.372,0.2404
1313,ITC,ITC’s arm incorporates wholly owned subsidiary,2023/03/16,09:29,0.0,0.828,0.172,0.0098
1314,ITC,ITC's Agri Business Division enters into partnership with Hyundai Motor India,2023/03/08,12:28,0.074,0.366,0.561,0.5663
1315,ITC,ITC incorporates wholly owned subsidiary ,2023/03/04,14:54,0.0,1.0,0.0,0.0
1316,ITC,ITC informs about incorporation of wholly owned subsidiary ,2023/03/04,11:49,0.124,0.734,0.142,0.037
1317,ITC,ITC informs about participation in investor conference,2023/02/10,14:22,0.244,0.222,0.534,0.3852
1318,ITC,ITC’s arm incorporates wholly owned subsidiary in France,2023/02/10,10:29,0.309,0.572,0.119,-0.1689
1319,ITC,ITC’s arm incorporates wholly owned subsidiary in Malaysia,2023/02/04,17:04,0.134,0.738,0.128,-0.013
1320,ITC,ITC reports 23% rise in Q3 consolidated net profit,2023/02/04,14:41,0.204,0.377,0.42,0.3178
1321,ITC,ITC - Quaterly Results,2023/02/03,17:08,0.0,1.0,0.0,0.0
1322,ITC,ITC - Quaterly Results,2023/02/03,17:08,0.0,1.0,0.0,0.0
1323,ITC,ITC - Quaterly Results,2023/02/03,17:08,0.0,1.0,0.0,0.0
1324,ITC,"ITC commissions food manufacturing, logistics facility in Telangana",2023/01/31,09:27,0.4,0.456,0.144,-0.0639
1325,ITC,ITC to acquire 100% stake in Sproutlife Foods ,2023/01/18,10:59,0.218,0.416,0.366,0.3459
1326,ITC,ITC informs about updates on acquisition,2022/12/07,15:42,0.0,0.421,0.579,0.2803
1327,ITC,ITC acquires additional stake in Delectable Technologies ,2022/12/07,14:11,0.098,0.269,0.634,0.7167
1328,ITC,ITC informs about ESG conference,2022/12/03,14:40,0.0,0.441,0.559,0.4231
1329,ITC,ITC informs about loss of share certificate ,2022/12/03,12:34,0.281,0.404,0.315,0.0646
1330,ITC,ITC’s hospitality arm inks pact with Jolle Hospitality ,2022/11/24,10:48,0.0,0.733,0.267,0.0479
1331,ITC,ITC acquires additional stake in Mother Sparsh Baby Care,2022/10/28,12:30,0.094,0.26,0.645,0.5175
1332,ITC,ITC informs about updates on acquisition,2022/10/28,12:14,0.0,0.421,0.579,0.2803
1333,ITC,ITC reports 24% rise in Q2 consolidated net profit,2022/10/21,11:45,0.204,0.377,0.42,0.3178
1334,ITC,ITC - Quaterly Results,2022/10/20,19:48,0.0,1.0,0.0,0.0
1335,ITC,ITC - Quaterly Results,2022/10/20,19:48,0.0,1.0,0.0,0.0
1336,ITC,ITC to acquire additional stake in Mother Sparsh Baby Care ,2022/10/19,09:38,0.159,0.151,0.69,0.6176
1337,ITC,ITC’s arm incorporates wholly owned subsidiary in Brazil ,2022/10/13,11:49,0.131,0.603,0.265,0.0287
1338,ITC,ITC informs about investor conferences,2022/09/14,15:12,0.0,0.581,0.419,0.0428
1339,ITC,ITC planning to pursue asset-right strategy for hotel business,2022/09/07,17:39,0.317,0.299,0.384,0.1724
1340,ITC,ITC informs about updates,2022/08/23,16:37,0.0,0.721,0.279,0.0415
1341,ITC,ITC informs about analyst meet ,2022/08/22,16:28,0.207,0.357,0.436,0.0742
1342,ITC,ITC features among winners in National CSR Awards 2020,2022/08/20,12:03,0.077,0.284,0.639,0.7851
1343,ITC,ITC completely moves out from lifestyle retailing business,2022/08/03,15:20,0.0,0.578,0.422,0.1669
1344,ITC,ITC reports 33% rise in Q1 consolidated net profit,2022/08/02,10:34,0.204,0.377,0.42,0.3178
1345,ITC,ITC - Quaterly Results,2022/08/01,17:09,0.0,1.0,0.0,0.0
1346,ITC,ITC - Quaterly Results,2022/08/01,17:09,0.0,1.0,0.0,0.0
1347,ITC,ITC - Quaterly Results,2022/08/01,17:09,0.0,1.0,0.0,0.0
1348,ITC,ITC informs about allotment of shares under ESOS,2022/07/26,15:18,0.226,0.42,0.353,0.2974
1349,ITC,ITC informs about board meeting intimation,2022/07/23,10:28,0.0,0.449,0.551,0.1751
1350,INDUSINDBK,IndusInd Bank partners with Bajaj Markets,2023/05/29,17:29,0.17,0.645,0.185,0.0232
1351,INDUSINDBK,Indusind Bank informs about details of loss of certificate ,2023/05/19,12:19,0.446,0.429,0.125,0.0001
1352,INDUSINDBK,IndusInd Bank informs about notice of postal ball,2023/05/04,10:30,0.242,0.35,0.407,0.1057
1353,INDUSINDBK,IndusInd Bank reports 46% rise in Q4 consolidated net profit  ,2023/04/24,15:28,0.276,0.342,0.382,0.305
1354,INDUSINDBK,Indusind Bank - Quaterly Results,2023/04/24,14:23,0.261,0.739,0.0,-0.015
1355,INDUSINDBK,Indusind Bank - Quaterly Results,2023/04/24,14:23,0.261,0.739,0.0,-0.015
1356,INDUSINDBK,Indusind Bank - Quaterly Results,2023/04/24,14:23,0.261,0.739,0.0,-0.015
1357,INDUSINDBK,IndusInd Bank informs about earnings call ,2023/04/22,09:57,0.157,0.296,0.547,0.161
1358,INDUSINDBK,IndusInd Bank inks pact with Japan Bank for International Cooperation,2023/04/19,12:42,0.279,0.357,0.364,0.2374
1359,INDUSINDBK,Indusind Bank informs about outcome of board meeting ,2023/04/14,12:58,0.235,0.226,0.539,0.1731
1360,INDUSINDBK,Indusind Bank informs about disclosure,2023/04/04,12:44,0.201,0.381,0.418,0.0347
1361,INDUSINDBK,IndusInd Bank’s net advances surge 21% in Q4FY23,2023/04/04,10:32,0.119,0.548,0.333,0.237
1362,INDUSINDBK,IndusInd Bank goes live on tax payment platform ‘TIN2.0’,2023/03/24,11:28,0.224,0.284,0.492,0.2102
1363,INDUSINDBK,IndusInd Bank informs about allotment of shares ESOS,2023/03/23,12:22,0.22,0.424,0.356,0.315
1364,INDUSINDBK,Indusind Bank informs about disclosure,2023/02/28,12:30,0.201,0.381,0.418,0.0347
1365,INDUSINDBK,Indusind Bank informs about loss of share certificate,2023/02/24,16:30,0.371,0.354,0.275,0.0497
1366,INDUSINDBK,Indusind Bank informs about interest payment,2023/02/20,17:12,0.147,0.278,0.575,0.2699
1367,INDUSINDBK,Indusind Bank informs about details of loss of certificate,2023/02/01,16:55,0.446,0.429,0.125,0.0001
1368,INDUSINDBK,Indusind Bank informs about analyst meet outcome,2023/02/01,16:52,0.287,0.259,0.455,0.0766
1369,INDUSINDBK,Indusind Bank informs about analyst meet ,2023/01/25,14:50,0.333,0.3,0.367,0.0593
1370,INDUSINDBK,IndusInd Bank reports 58% rise in Q3 consolidated net profit,2023/01/18,16:44,0.276,0.342,0.382,0.305
1371,INDUSINDBK,Indusind Bank - Quaterly Results,2023/01/18,15:44,0.261,0.739,0.0,-0.015
1372,INDUSINDBK,Indusind Bank - Quaterly Results,2023/01/18,15:44,0.261,0.739,0.0,-0.015
1373,INDUSINDBK,Indusind Bank - Quaterly Results,2023/01/18,15:44,0.261,0.739,0.0,-0.015
1374,INDUSINDBK,Indusind Bank informs about analyst meet,2023/01/17,17:13,0.333,0.3,0.367,0.0593
1375,INDUSINDBK,IndusInd Bank informs about loss of share certificate,2023/01/05,17:11,0.371,0.354,0.275,0.0497
1376,INDUSINDBK,"IndusInd Bank partners with Qatar Airways, British Airways to introduce credit card ",2023/01/05,12:21,0.336,0.452,0.212,0.0891
1377,INDUSINDBK,IndusInd Bank’s net advances surge 19% in Q3FY23,2023/01/04,10:29,0.119,0.548,0.333,0.237
1378,INDUSINDBK,IndusInd Bank inaugurates branch in Srinagar,2022/12/22,12:52,0.349,0.651,0.0,-0.0377
1379,INDUSINDBK,IndusInd Bank ties-up with SV Credit Line,2022/12/09,09:18,0.296,0.4,0.304,0.0168
1380,INDUSINDBK,Indusind Bank informs about press release,2022/12/02,12:36,0.147,0.279,0.574,0.2649
1381,INDUSINDBK,IndusInd Bank joins hand with Tata Motors,2022/11/30,11:07,0.144,0.545,0.31,0.0562
1382,INDUSINDBK,IndusInd Bank informs about loss of share certificate,2022/11/24,17:09,0.371,0.354,0.275,0.0497
1383,INDUSINDBK,Indusind Bank informs about analyst meet,2022/11/17,17:25,0.333,0.3,0.367,0.0593
1384,INDUSINDBK,IndusInd Bank inks pact with Department of Panchayati Raj-Government of Uttarakhand,2022/11/16,15:52,0.275,0.623,0.102,0.0142
1385,INDUSINDBK,IndusInd Bank informs about loss of share certificate,2022/11/10,16:40,0.371,0.354,0.275,0.0497
1386,INDUSINDBK,Indusind Bank informs about analyst meet,2022/11/08,11:22,0.333,0.3,0.367,0.0593
1387,INDUSINDBK,Indusind Bank informs about loss of share certificates,2022/11/01,16:12,0.371,0.354,0.275,0.0497
1388,INDUSINDBK,IndusInd Bank inks pact with Kinetic Green,2022/10/27,11:06,0.144,0.546,0.31,0.0556
1389,INDUSINDBK,IndusInd Bank to raise $150 million loan from DFC,2022/10/21,15:10,0.303,0.295,0.403,0.2549
1390,INDUSINDBK,IndusInd Bank launches 4G Soundbox for merchants,2022/10/20,16:52,0.149,0.705,0.145,-0.0068
1391,INDUSINDBK,IndusInd Bank reports 57% rise in Q2 consolidated net profit,2022/10/20,10:35,0.276,0.342,0.382,0.305
1392,INDUSINDBK,Indusind Bank - Quaterly Results,2022/10/19,16:44,0.261,0.739,0.0,-0.015
1393,INDUSINDBK,Indusind Bank - Quaterly Results,2022/10/19,16:44,0.261,0.739,0.0,-0.015
1394,INDUSINDBK,Indusind Bank - Quaterly Results,2022/10/19,16:44,0.261,0.739,0.0,-0.015
1395,INDUSINDBK,IndusInd Bank launches ‘BankOnHappiness’ festive campaign,2022/10/17,12:05,0.125,0.354,0.521,0.5209
1396,INDUSINDBK,IndusInd Bank bags ‘Governance Now’ Award for ‘SME Connect’ category,2022/10/14,11:28,0.08,0.453,0.467,0.6293
1397,INDUSINDBK,Route One Fund I LP divests stake in IndusInd Bank ,2022/10/12,12:39,0.316,0.273,0.411,0.262
1398,INDUSINDBK,Indusind Bank informs about details of loss of certificate ,2022/10/10,17:05,0.446,0.429,0.125,0.0001
1399,INDUSINDBK,SEBI imposes penalty of Rs 1 crore on IndusInd Bank,2022/10/06,11:52,0.56,0.346,0.094,-0.5253
1400,JSWSTEEL,JSW Steel becomes first manufacturer to achieve GreenPro Ecolabel for 'Automotive Steel' Products,2023/05/31,10:51,0.213,0.419,0.367,0.2976
1401,JSWSTEEL,Jsw Steel submits annual secretarial compliance report,2023/05/30,14:12,0.0,0.318,0.682,0.5314
1402,JSWSTEEL,JSW Steel informs about transcript of earnings call,2023/05/25,14:20,0.093,0.183,0.724,0.5998
1403,JSWSTEEL,"JSW Steel, JFE Steel sign MoU to establish CRGO electrical steel manufacturing JV in India",2023/05/23,12:16,0.195,0.392,0.413,0.4372
1404,JSWSTEEL,"JSW Steel gets nod to raise funds up to Rs 17,000 crore through various securities",2023/05/22,14:12,0.165,0.379,0.455,0.6543
1405,JSWSTEEL,Jsw Steel informs about RPT disclosure,2023/05/20,12:32,0.0,0.268,0.732,0.3522
1406,JSWSTEEL,JSW Steel reports 12% rise in Q4 consolidated net profit,2023/05/19,17:59,0.179,0.332,0.489,0.4079
1407,JSWSTEEL,JSW Steel - Quaterly Results,2023/05/19,15:52,0.0,0.677,0.323,0.1109
1408,JSWSTEEL,JSW Steel - Quaterly Results,2023/05/19,15:52,0.0,0.677,0.323,0.1109
1409,JSWSTEEL,JSW Steel - Quaterly Results,2023/05/19,15:52,0.0,0.677,0.323,0.1109
1410,JSWSTEEL,JSW Steel declared as preferred bidder for unexplored Iron Ore mine in Gadchiroli District,2023/05/18,09:11,0.179,0.284,0.537,0.6499
1411,JSWSTEEL,JSW Steel informs about press release,2023/05/10,09:57,0.0,0.265,0.735,0.3724
1412,JSWSTEEL,JSW Steel reports 7% rise in crude steel production in April,2023/05/10,09:19,0.355,0.307,0.339,0.1993
1413,JSWSTEEL,JSW Steel informs about press release,2023/05/03,10:19,0.0,0.265,0.735,0.3724
1414,JSWSTEEL,JSW Steel’s arm to invest $145 million to upgrade manufacturing operations,2023/05/03,09:39,0.277,0.326,0.397,0.1227
1415,JSWSTEEL,JSW Steel informs about press release ,2023/04/10,18:26,0.0,0.265,0.735,0.3724
1416,JSWSTEEL,JSW Steel reports growth of 13% in crude steel production in Q4FY23,2023/04/10,16:30,0.321,0.281,0.398,0.2711
1417,JSWSTEEL,JSW Steel declared as preferred bidder for Jaisinghpura South Iron Ore Block in Karnataka ,2023/04/05,12:25,0.312,0.209,0.479,0.2951
1418,JSWSTEEL,JSW Steel raises Rs 1500 crore through NCDs,2023/03/29,14:39,0.122,0.709,0.169,0.1026
1419,JSWSTEEL,JSW Steel informs about group meeting ,2023/03/14,10:06,0.0,0.272,0.728,0.3295
1420,JSWSTEEL,JSW Steel’s arm acquires stake in Ayena Innovation,2023/03/13,11:41,0.258,0.433,0.309,0.1223
1421,JSWSTEEL,JSW Steel’s arm collaborates with TrueNorth Collective,2023/03/09,16:13,0.0,0.696,0.304,0.0479
1422,JSWSTEEL,JSW Steel reports 10% rise in crude steel production in February,2023/03/09,09:57,0.355,0.307,0.339,0.1993
1423,JSWSTEEL,JSW Steel informs about press release,2023/03/09,09:43,0.0,0.265,0.735,0.3724
1424,JSWSTEEL,JSW Steel informs about press release,2023/03/09,09:42,0.0,0.265,0.735,0.3724
1425,JSWSTEEL,Jsw Steel informs about analyst meet,2023/02/27,14:58,0.164,0.284,0.551,0.1829
1426,JSWSTEEL,JSW Steel informs about disclosure,2023/02/17,13:07,0.0,0.356,0.644,0.1593
1427,JSWSTEEL,JSW Steel informs about press release  ,2023/02/13,09:42,0.0,0.265,0.735,0.3724
1428,JSWSTEEL,JSW Steel reports 16% rise in crude steel production in January,2023/02/13,09:39,0.355,0.307,0.339,0.1993
1429,JSWSTEEL,JSW Steel informs about loss of share certificates,2023/02/09,16:51,0.236,0.339,0.426,0.1737
1430,JSWSTEEL,JSW Steel informs about transcripts of earnings conference call,2023/01/27,11:50,0.086,0.255,0.659,0.5792
1431,JSWSTEEL,JSW Steel informs about disclosure,2023/01/24,12:31,0.0,0.356,0.644,0.1593
1432,JSWSTEEL,JSW Steel’s arm enters into share subscription agreement with Ayena Innovation,2023/01/24,12:29,0.237,0.281,0.482,0.5417
1433,JSWSTEEL,JSW Steel informs about newspaper publication,2023/01/23,12:41,0.0,0.365,0.635,0.4984
1434,JSWSTEEL,JSW Steel reports 90% fall in Q3 consolidated net profit,2023/01/21,14:20,0.21,0.319,0.471,0.31
1435,JSWSTEEL,JSW Steel - Quaterly Results,2023/01/20,15:37,0.0,0.677,0.323,0.1109
1436,JSWSTEEL,JSW Steel - Quaterly Results,2023/01/20,15:37,0.0,0.677,0.323,0.1109
1437,JSWSTEEL,JSW Steel - Quaterly Results,2023/01/20,15:37,0.0,0.677,0.323,0.1109
1438,JSWSTEEL,JSW Steel reports 17% rise in group combined crude steel production during Q3 FY23,2023/01/09,10:51,0.212,0.36,0.428,0.3828
