,Ticker,Headline,Date,Time,neg,neu,pos,compound
471,BAJAJ-AUTO,Bajaj Auto - Quaterly Results,2023/01/25,15:27,0.258,0.742,0.0,-0.0118
472,BAJAJ-AUTO,Bajaj Auto informs about press release,2023/01/02,11:20,0.146,0.279,0.575,0.2676
473,BAJAJ-AUTO,Bajaj Auto reports 22% fall in December sales ,2023/01/02,10:01,0.424,0.576,0.0,-0.1718
474,BAJAJ-AUTO,Bajaj Auto informs about analyst meet ,2022/12/15,11:37,0.331,0.301,0.368,0.0624
475,BAJAJ-AUTO,Bajaj Auto reports 19% fall in November sales,2022/12/01,10:30,0.424,0.576,0.0,-0.1718
476,BAJAJ-AUTO,Bajaj Auto informs about press release,2022/12/01,09:45,0.146,0.279,0.575,0.2676
477,BAJAJ-AUTO,Bajaj Auto launches all-new Pulsar P150,2022/11/23,15:58,0.173,0.827,0.0,-0.0118
478,BAJAJ-AUTO,Bajaj Auto informs about scrutinisers report,2022/11/21,17:22,0.156,0.447,0.397,0.1575
479,BAJAJ-AUTO,Bajaj Auto reports 10% fall in October sales,2022/11/01,10:29,0.424,0.576,0.0,-0.1718
480,BAJAJ-AUTO,Bajaj Auto informs about press release,2022/11/01,09:45,0.146,0.279,0.575,0.2676
481,BAJAJ-AUTO,Bajaj Auto informs about newspaper publication ,2022/10/22,15:31,0.133,0.383,0.484,0.4114
482,BAJAJ-AUTO,Bajaj Auto reports 16% fall in Q2 consolidated net profit,2022/10/15,11:22,0.303,0.33,0.368,0.1986
483,BAJAJ-AUTO,Bajaj Auto - Quaterly Results,2022/10/14,16:11,0.258,0.742,0.0,-0.0118
484,BAJAJ-AUTO,Bajaj Auto - Quaterly Results,2022/10/14,16:11,0.258,0.742,0.0,-0.0118
485,BAJAJ-AUTO,Bajaj Auto - Quaterly Results,2022/10/14,16:11,0.258,0.742,0.0,-0.0118
486,BAJAJ-AUTO,Bajaj Auto buys back over 64 lakh shares from public shareholders ,2022/10/11,15:08,0.26,0.387,0.353,0.2973
487,BAJAJ-AUTO,Bajaj Auto informs about compliance certificate,2022/10/10,12:22,0.157,0.451,0.392,0.1439
488,BAJAJ-AUTO,Bajaj Auto informs about press release,2022/10/03,12:05,0.146,0.279,0.575,0.2676
489,BAJAJ-AUTO,Bajaj Auto reports 2% fall in September sales ,2022/10/03,11:29,0.424,0.576,0.0,-0.1718
490,BAJAJ-AUTO,Bajaj Auto reports 8% rise in August sales,2022/09/01,10:23,0.391,0.609,0.0,-0.0536
491,BAJAJ-AUTO,Bajaj Auto informs about press release,2022/09/01,09:53,0.146,0.279,0.575,0.2676
492,BAJAJ-AUTO,Bajaj Auto informs about buyback of equity shares,2022/08/25,12:35,0.32,0.187,0.493,0.432
493,BAJAJ-AUTO,Bajaj Auto reports marginal fall in July sales,2022/08/01,10:23,0.424,0.576,0.0,-0.1718
494,BAJAJ-AUTO,Bajaj Auto informs about press release,2022/08/01,10:11,0.146,0.279,0.575,0.2676
495,BAJAJ-AUTO,Bajaj Auto reports marginal fall in Q1 consolidated net profit,2022/07/26,15:12,0.303,0.33,0.368,0.1986
496,BAJAJ-AUTO,Bajaj Auto - Quaterly Results,2022/07/26,13:50,0.258,0.742,0.0,-0.0118
497,BAJAJ-AUTO,Bajaj Auto - Quaterly Results,2022/07/26,13:50,0.258,0.742,0.0,-0.0118
498,BAJAJ-AUTO,Bajaj Auto - Quaterly Results,2022/07/26,13:50,0.258,0.742,0.0,-0.0118
499,BAJAJ-AUTO,Bajaj Auto to scale up sales infrastructure for Chetak from 75 locations in FY23,2022/07/05,16:30,0.275,0.378,0.347,0.2846
500,BHARTIARTL,Bharti Airtel planning to complete 5G rollout in urban areas this year,2023/05/18,17:00,0.331,0.357,0.313,0.1897
501,BHARTIARTL,Bharti Airtel surpasses 2 million customer mark on 5G network in Tamil Nadu,2023/05/18,15:11,0.264,0.448,0.287,0.0793
502,BHARTIARTL,Bharti Airtel reports 14% rise in Q4 consolidated net profit,2023/05/16,17:36,0.186,0.43,0.384,0.3178
503,BHARTIARTL,Bharti Airtel - Quaterly Results,2023/05/16,16:24,0.0,1.0,0.0,0.0
504,BHARTIARTL,Bharti Airtel - Quaterly Results,2023/05/16,16:24,0.0,1.0,0.0,0.0
505,BHARTIARTL,Bharti Airtel - Quaterly Results,2023/05/16,16:24,0.0,1.0,0.0,0.0
506,BHARTIARTL,Bharti Airtel to offer content from FanCode to subscribers on Airtel Xstream ,2023/05/12,12:30,0.241,0.461,0.298,0.1888
507,BHARTIARTL,"Bharti Airtel crosses 2 million customer mark on 5G network in Andhra Pradesh, Telangana",2023/05/10,13:03,0.246,0.487,0.267,0.0793
508,BHARTIARTL,Bharti Airtel registers 2 million customer on 5G network in Mumbai,2023/05/09,13:00,0.217,0.442,0.34,0.1005
509,BHARTIARTL,"Bharti Airtel to offer content from ALTT, FanCode to subscribers on Airtel Xstream",2023/05/08,16:29,0.224,0.499,0.277,0.1888
510,BHARTIARTL,"Bharti Airtel signs pact with Dialog, Axiata Group to combine operations in Sri Lanka",2023/05/02,18:19,0.139,0.597,0.264,0.2218
511,BHARTIARTL,Bharti Airtel enters into strategic partnership with Bridgepointe Technologies,2023/05/02,12:08,0.084,0.417,0.498,0.6071
512,BHARTIARTL,"Bharti Airtel augments 5G services across 3000 cities, towns in country",2023/04/27,17:05,0.178,0.678,0.144,0.1544
513,BHARTIARTL,Bharti Airtel enters into partnership with Secure Meters ,2023/04/24,14:39,0.091,0.36,0.549,0.6223
514,BHARTIARTL,Bharti Airtel launches 5G services in Ladakh,2023/04/12,12:21,0.154,0.846,0.0,-0.0228
515,BHARTIARTL,"Bharti Airtel, IPPB launch WhatsApp banking services ",2023/03/31,15:37,0.136,0.668,0.196,0.1134
516,BHARTIARTL,Bharti Airtel’s arm inks pact to acquire additional stake in Avaada MHAmravati,2023/03/31,14:57,0.15,0.428,0.422,0.4247
517,BHARTIARTL,Bharti Airtel launches 5G services in Port Blair,2023/03/27,14:37,0.113,0.623,0.264,0.3513
518,BHARTIARTL,Bharti Airtel informs about press release,2023/03/27,13:11,0.0,0.421,0.579,0.2782
519,BHARTIARTL,Bharti Airtel augments 5G services across 500 cities in country,2023/03/24,16:09,0.194,0.648,0.158,0.1544
520,BHARTIARTL,Bharti Airtel informs about press release ,2023/03/22,16:51,0.0,0.421,0.579,0.2782
521,BHARTIARTL,Bharti Airtel launches cutting edge 5G services in Kolkata,2023/03/22,11:58,0.382,0.618,0.0,-0.1796
522,BHARTIARTL,Bharti Airtel rolls out family plans to attract prepaid users to switch to postpaid connections,2023/03/21,11:43,0.35,0.483,0.168,-0.0038
523,BHARTIARTL,Bharti Airtel launches introductory unlimited data offer for 5G customers,2023/03/17,15:08,0.105,0.65,0.245,0.1291
524,BHARTIARTL,Bharti Airtel wins Dun & Bradstreet award for ESG Excellence,2023/03/15,16:30,0.0,0.289,0.711,0.9067
525,BHARTIARTL,Bharti Airtel launches ultra-fast 5G services in 125 cities,2023/03/06,15:10,0.12,0.88,0.0,-0.0228
526,BHARTIARTL,Bharti Airtel informs about press release ,2023/03/06,14:08,0.0,0.421,0.579,0.2782
527,BHARTIARTL,Bharti Airtel informs about press release,2023/03/02,15:04,0.0,0.421,0.579,0.2782
528,BHARTIARTL,Bharti Airtel crosses 1 million 5G user mark in Mumbai,2023/03/02,14:23,0.347,0.522,0.13,-0.0202
529,BHARTIARTL,"Bharti Airtel planning to increase call, data rates across all plans this year",2023/03/01,12:48,0.303,0.36,0.336,0.1172
530,BHARTIARTL,Bharti Airtel informs about press release ,2023/02/27,16:48,0.0,0.421,0.579,0.2782
531,BHARTIARTL,"Bharti Airtel launches 5G services in Katra, Anantnag, Baramulla, Rajouri",2023/02/27,14:05,0.108,0.892,0.0,-0.0228
532,BHARTIARTL,Bharti Airtel crosses 10 million unique 5G user mark,2023/02/27,12:58,0.225,0.503,0.271,0.1166
533,BHARTIARTL,Bharti Airtel builds AI-based solution in collaboration with NVIDIA,2023/02/25,15:14,0.117,0.644,0.239,0.0372
534,BHARTIARTL,Bharti Airtel informs about press release ,2023/02/23,16:16,0.0,0.421,0.579,0.2782
535,BHARTIARTL,"Bharti Airtel launches 5G services in Chandigarh, Mohali, Panchkula",2023/02/23,15:28,0.12,0.88,0.0,-0.0228
536,BHARTIARTL,Bharti Airtel creates 5G experience zones across all retail stores,2023/02/23,14:42,0.375,0.44,0.185,0.2107
537,BHARTIARTL,Bharti Airtel informs about press release,2023/02/23,12:35,0.0,0.421,0.579,0.2782
538,BHARTIARTL,Bharti Airtel informs about press release,2023/02/21,16:26,0.0,0.421,0.579,0.2782
539,BHARTIARTL,Bharti Airtel launches cutting edge 5G services in Haridwar,2023/02/21,14:29,0.382,0.618,0.0,-0.1796
540,BHARTIARTL,Bharti Airtel launches 5G services in 5 cities of Rajasthan,2023/02/21,12:29,0.231,0.769,0.0,-0.0273
541,BHARTIARTL,Bharti Airtel informs about press release,2023/02/20,14:56,0.0,0.421,0.579,0.2782
542,BHARTIARTL,Bharti Airtel launches 5G services in 15 cities of West Bengal,2023/02/20,12:30,0.18,0.684,0.136,0.1231
543,BHARTIARTL,Bharti Airtel informs about press release,2023/02/17,15:14,0.0,0.421,0.579,0.2782
544,BHARTIARTL,Bharti Airtel informs about press release,2023/02/17,15:05,0.0,0.421,0.579,0.2782
545,BHARTIARTL,Bharti Airtel adds 15.26 lakh subscribers in December,2023/02/17,12:13,0.135,0.865,0.0,-0.0228
546,BHARTIARTL,Bharti Airtel launches 5G services in more North-East cities,2023/02/15,14:56,0.12,0.88,0.0,-0.0228
547,BHARTIARTL,Bharti Airtel informs about press release ,2023/02/10,17:06,0.0,0.421,0.579,0.2782
548,BHARTIARTL,Bharti Airtel launches 5G services in 5 more cities of Haryana,2023/02/10,14:41,0.208,0.792,0.0,-0.0273
549,BHARTIARTL,Bharti Airtel informs about press release,2023/02/09,15:36,0.0,0.421,0.579,0.2782
550,DIVISLAB,Divi's Laboratories informs about secretarial compliance report,2023/05/23,11:25,0.0,0.493,0.507,0.2758
551,DIVISLAB,Divi's Laboratories reports 64% fall in Q4 consolidated net profit,2023/05/22,12:44,0.217,0.414,0.369,0.2097
552,DIVISLAB,Divi's Lab - Quaterly Results,2023/05/20,13:28,0.0,0.681,0.319,0.1048
553,DIVISLAB,Divi's Lab - Quaterly Results,2023/05/20,13:28,0.0,0.681,0.319,0.1048
554,DIVISLAB,Divi's Lab - Quaterly Results,2023/05/20,13:28,0.0,0.681,0.319,0.1048
555,DIVISLAB,Divi's Laboratories informs about certificate ,2023/04/11,09:21,0.0,0.775,0.225,0.0415
556,DIVISLAB,Divi's Laboratories reports 66% fall in Q3 consolidated net profit,2023/02/03,15:19,0.217,0.414,0.369,0.2097
557,DIVISLAB,Divi's Lab - Quaterly Results,2023/02/03,12:51,0.0,0.681,0.319,0.1048
558,DIVISLAB,Divi's Lab - Quaterly Results,2023/02/03,12:51,0.0,0.681,0.319,0.1048
559,DIVISLAB,Divi's Lab - Quaterly Results,2023/02/03,12:51,0.0,0.681,0.319,0.1048
560,DIVISLAB,Divi’s Laboratories informs about conference call,2023/01/25,09:58,0.0,0.371,0.629,0.4733
561,DIVISLAB,Divi's Laboratories informs about trading window closure,2022/12/24,16:16,0.153,0.39,0.457,0.0853
562,DIVISLAB,Divi's Laboratories informs about newspaper publication,2022/12/24,12:06,0.0,0.513,0.487,0.4203
563,DIVISLAB,Divi's Laboratories reports 19% fall in Q2 consolidated net profit,2022/11/08,11:59,0.217,0.414,0.369,0.2097
564,DIVISLAB,Divi's Lab - Quaterly Results,2022/11/07,12:52,0.0,0.681,0.319,0.1048
565,DIVISLAB,Divi's Lab - Quaterly Results,2022/11/07,12:52,0.0,0.681,0.319,0.1048
566,DIVISLAB,Divi's Lab - Quaterly Results,2022/11/07,12:52,0.0,0.681,0.319,0.1048
567,DIVISLAB,Divi's Laboratories informs about board meeting,2022/10/28,15:37,0.0,0.449,0.551,0.1751
568,DIVISLAB,Divi's Laboratories reports 26% rise in Q1 consolidated net profit ,2022/08/12,16:53,0.186,0.43,0.384,0.3178
569,DIVISLAB,Divi's Lab - Quaterly Results,2022/08/12,12:26,0.0,0.681,0.319,0.1048
570,DIVISLAB,Divi's Lab - Quaterly Results,2022/08/12,12:26,0.0,0.681,0.319,0.1048
571,DIVISLAB,Divi's Lab - Quaterly Results,2022/08/12,12:26,0.0,0.681,0.319,0.1048
572,DIVISLAB,Divi's Laboratories informs about newspaper publication,2022/07/26,17:03,0.0,0.513,0.487,0.4203
573,DIVISLAB,Divi's Laboratories informs about press release,2022/07/20,17:17,0.0,0.421,0.579,0.2782
574,DIVISLAB,Divi’s Laboratories reports 78% rise in Q4 consolidated net profit,2022/05/23,14:38,0.186,0.43,0.384,0.3178
575,DIVISLAB,Divi's Lab - Quaterly Results,2022/05/23,12:20,0.0,0.681,0.319,0.1048
576,DIVISLAB,Divi's Lab - Quaterly Results,2022/05/23,12:20,0.0,0.681,0.319,0.1048
577,DIVISLAB,Divi's Lab - Quaterly Results,2022/05/23,12:20,0.0,0.681,0.319,0.1048
578,DIVISLAB,Divi's Laboratories informs about compliance report,2022/05/12,17:14,0.0,0.422,0.578,0.2758
579,DIVISLAB,Divi's Laboratories informs about non-applicability of large corporate,2022/04/12,09:29,0.281,0.466,0.254,-0.0595
580,DIVISLAB,Divi’s Laboratories informs about newspaper advertisement,2022/02/26,15:14,0.0,0.812,0.188,0.0415
581,DIVISLAB,Divi's Laboratories reports 92% rise in Q3 consolidated net profit ,2022/02/11,14:15,0.186,0.43,0.384,0.3178
582,DIVISLAB,Divi's Lab - Quaterly Results,2022/02/11,11:59,0.0,0.681,0.319,0.1048
583,DIVISLAB,Divi's Lab - Quaterly Results,2022/02/11,11:59,0.0,0.681,0.319,0.1048
584,DIVISLAB,Divi's Lab - Quaterly Results,2022/02/11,11:59,0.0,0.681,0.319,0.1048
585,DIVISLAB,Divi’s Laboratories informs about earnings conference call,2022/02/03,16:56,0.0,0.321,0.679,0.5166
586,DIVISLAB,Divi's Laboratories submits certificate,2022/01/07,10:35,0.0,1.0,0.0,0.0
587,DIVISLAB,Divi's Laboratories reports 17% rise in Q2 consolidated net profit,2021/11/08,09:30,0.186,0.43,0.384,0.3178
588,DIVISLAB,Divis Laboratories informs about outcome of board meeting,2021/11/06,12:50,0.116,0.342,0.542,0.1873
589,DIVISLAB,Divi's Lab - Quaterly Results,2021/11/06,11:48,0.0,0.681,0.319,0.1048
590,DIVISLAB,Divi's Lab - Quaterly Results,2021/11/06,11:48,0.0,0.681,0.319,0.1048
591,DIVISLAB,Divi's Lab - Quaterly Results,2021/11/06,11:48,0.0,0.681,0.319,0.1048
592,DIVISLAB,Divi’s Laboratories informs about earnings conference call,2021/11/02,09:53,0.0,0.321,0.679,0.5166
593,DIVISLAB,Divis Laboratories informs about updates,2021/08/30,15:47,0.0,0.775,0.225,0.0415
594,DIVISLAB,Divi’s Laboratories reports 13% rise in Q1 consolidated net profit ,2021/08/09,12:21,0.186,0.43,0.384,0.3178
595,DIVISLAB,Divi’s Laboratories informs about newspaper publication,2021/07/21,15:41,0.0,0.513,0.487,0.4203
596,DIVISLAB,Divis Laboratories informs about annual secretarial compliance report,2021/06/01,10:04,0.0,0.394,0.606,0.4868
597,DIVISLAB,Divis Laboratories informs about manufacturing of molnupiravir API ,2021/05/26,17:06,0.28,0.584,0.136,-0.0611
598,DIVISLAB,Divi's Laboratories informs about schedule of earnings conference call ,2021/05/22,12:23,0.087,0.255,0.658,0.5746
599,DIVISLAB,Divis Laboratories informs about closure of trading window,2021/03/31,11:35,0.252,0.345,0.403,0.0808
600,DRREDDY,USFDA completes inspection at Dr. Reddy's formulations manufacturing facility in Srikakulam,2023/05/13,10:27,0.27,0.465,0.266,0.2372
601,DRREDDY,Dr. Reddy’s Laboratories informs about audio recording of earnings call,2023/05/11,11:52,0.086,0.421,0.493,0.4293
602,DRREDDY,Dr. Reddy's Laboratories reports around 10-fold jump in Q4 consolidated net profit  ,2023/05/10,18:12,0.15,0.318,0.532,0.6143
603,DRREDDY,Dr. Reddy's Lab - Quaterly Results,2023/05/10,17:10,0.0,0.456,0.544,0.377
604,DRREDDY,Dr. Reddy's Lab - Quaterly Results,2023/05/10,17:10,0.0,0.456,0.544,0.377
605,DRREDDY,Dr. Reddy's Lab - Quaterly Results,2023/05/10,17:10,0.0,0.456,0.544,0.377
606,DRREDDY,Dr. Reddy's Laboratories gets one observations from USFDA for Hyderabad facility,2023/05/06,10:52,0.0,0.452,0.548,0.5043
607,DRREDDY,Dr. Reddy's Laboratories launches Regadenoson Injection in U.S. market,2023/05/05,15:50,0.361,0.446,0.193,0.0312
608,DRREDDY,Dr Reddy's Laboratories informs about press release ,2023/04/21,16:37,0.0,0.323,0.677,0.509
609,DRREDDY,Dr. Reddy's Laboratories launches Treprostinil Injection in U.S. market,2023/04/21,12:00,0.361,0.446,0.193,0.0312
610,DRREDDY,DR. Reddy's Laboratories informs about allotment of ESOP,2023/03/21,13:19,0.101,0.496,0.403,0.4669
611,DRREDDY,Dr Reddy's signs deal to divest certain non-core brands in dermatology to Eris Lifesciences,2023/03/16,16:17,0.199,0.512,0.289,0.3401
612,DRREDDY,"Dr Reddy's Laboratories’ arm recalling 4,320 bottles of Tacrolimus Capsules in US",2023/03/08,11:29,0.158,0.601,0.241,0.2734
613,DRREDDY,Dr. Reddy’s Laboratories informs about investors conferences ,2023/02/28,10:44,0.0,0.6,0.4,0.3247
614,DRREDDY,Dr. Reddy’s Laboratories’ arm inks pact to acquire Mayne Pharma’s U.S. generic prescription product portfolio ,2023/02/27,12:29,0.154,0.368,0.477,0.4837
615,DRREDDY,Dr. Reddy’s Laboratories informs about press release,2023/02/27,09:42,0.0,0.323,0.677,0.509
616,DRREDDY,Dr. Reddy's Laboratories included in Bloomberg GEI 2023 for sixth consecutive year,2023/02/09,10:30,0.172,0.422,0.406,0.3241
617,DRREDDY,Dr. Reddy's Laboratories informs about press release ,2023/01/27,15:07,0.0,0.323,0.677,0.509
618,DRREDDY,Dr. Reddy’s launches Difluprednate Ophthalmic Emulsion in US market,2023/01/27,12:30,0.207,0.583,0.211,0.2591
619,DRREDDY,Dr. Reddy's Laboratories reports 75% rise in Q3 consolidated net profit,2023/01/27,10:40,0.157,0.363,0.481,0.5372
620,DRREDDY,Dr.Reddy's Laboratories informs about disclosure,2023/01/25,16:29,0.0,0.578,0.422,0.0497
621,DRREDDY,Dr. Reddy's Lab - Quaterly Results,2023/01/25,16:09,0.0,0.456,0.544,0.377
622,DRREDDY,Dr. Reddy's Lab - Quaterly Results,2023/01/25,16:09,0.0,0.456,0.544,0.377
623,DRREDDY,Dr. Reddy's Lab - Quaterly Results,2023/01/25,16:09,0.0,0.456,0.544,0.377
624,DRREDDY,"Dr. Reddy’s completes full set of clinical studies of rituximab biosimilar for filing in U.S., Europe",2023/01/20,14:40,0.196,0.28,0.524,0.7922
625,DRREDDY,Dr. Reddy’s Laboratories informs about press release,2023/01/20,09:48,0.0,0.323,0.677,0.509
626,DRREDDY,Dr Reddy's reduces price of cardiovascular drug ‘Cidmus’,2023/01/19,10:50,0.098,0.385,0.517,0.5197
627,DRREDDY,Dr. Reddy’s acquires trademark rights of breast cancer drug PRIMCYV from Pfizer Products,2023/01/13,18:08,0.111,0.326,0.563,0.809
628,DRREDDY,Dr. Reddy's inks pact with Theranica ,2023/01/11,16:09,0.0,0.547,0.453,0.3218
629,DRREDDY,Dr. Reddy’s Laboratories informs about disclosure ,2022/12/29,09:28,0.0,0.408,0.592,0.3315
630,DRREDDY,Dr. Reddy's Laboratories completes Phase 1 study of proposed biosimilar of Tocilizumab,2022/12/20,11:51,0.151,0.445,0.404,0.53
631,DRREDDY,Dr.Reddy's Laboratories informs about press release,2022/12/19,13:49,0.0,0.421,0.579,0.2782
632,DRREDDY,"Dr. Reddy's Laboratories’ arm enters into agreement to sell certain assets, liabilities",2022/12/19,11:35,0.219,0.172,0.609,0.7024
633,DRREDDY,Dr. Reddy’s Laboratories informs about asset purchase agreement of subsidiary company ,2022/12/17,10:49,0.134,0.251,0.615,0.77
634,DRREDDY,Dr Reddy's Laboratories informs about press release ,2022/12/16,16:19,0.0,0.323,0.677,0.509
635,DRREDDY,Dr. Reddy's Laboratories’ arm reports results of AUR101 in Phase II Study in Patients with moderate to severe psoriasis,2022/12/16,12:59,0.317,0.298,0.385,0.3773
636,DRREDDY,Dr.Reddy's Laboratories informs about analyst meet,2022/12/07,11:34,0.175,0.454,0.37,0.0742
637,DRREDDY,"Dr. Reddy's arm recalls over 48,000 cartons of drug used to treat sneezing, runny or stuffy nose",2022/12/05,09:47,0.295,0.392,0.312,0.3278
638,DRREDDY,"Dr Reddy's Laboratories earmarks capex of around Rs 1,500 crore for FY23",2022/11/07,11:19,0.257,0.51,0.233,0.169
639,DRREDDY,Dr. Reddy’s Laboratories informs about newspaper advertisement,2022/10/31,12:46,0.0,0.6,0.4,0.3247
640,DRREDDY,Dr. Reddy’s Laboratories informs about link of audio recordings,2022/10/29,15:55,0.094,0.464,0.441,0.4085
641,DRREDDY,Dr. Reddy's Laboratories reports 12% rise in Q2 consolidated net profit,2022/10/29,12:27,0.157,0.363,0.481,0.5372
642,DRREDDY,Dr. Reddy's Lab - Quaterly Results,2022/10/28,16:23,0.0,0.456,0.544,0.377
643,DRREDDY,Dr. Reddy's Lab - Quaterly Results,2022/10/28,16:23,0.0,0.456,0.544,0.377
644,DRREDDY,Dr. Reddy's Lab - Quaterly Results,2022/10/28,16:23,0.0,0.456,0.544,0.377
645,DRREDDY,Dr Reddy's recalling Phytonadione Injectable Emulsion in US ,2022/10/25,10:09,0.118,0.648,0.234,0.2687
646,DRREDDY,Dr.Reddy's Laboratories informs about notice of postal ballot,2022/10/22,11:08,0.122,0.6,0.278,0.0767
647,DRREDDY,Dr.Reddy's Laboratories informs about earnings call ,2022/10/13,12:27,0.0,0.448,0.552,0.1753
648,DRREDDY,WEF recognizes Dr. Reddy’s Hyderabad factory as part of Global Lighthouse Network,2022/10/11,16:15,0.156,0.355,0.489,0.4027
649,DRREDDY,Dr Reddy's Laboratories informs about allotment under ESOP,2022/10/07,12:39,0.12,0.528,0.352,0.2943
650,COALINDIA,Coal India hikes prices of non-coking coal by 8%,2023/05/31,09:51,0.105,0.518,0.377,0.1595
651,COALINDIA,Coal India eyeing to conclude eleventh version of national coal wage agreement,2023/05/11,11:20,0.192,0.246,0.562,0.7196
652,COALINDIA,Coal India informs about press release,2023/05/10,13:32,0.0,0.269,0.731,0.3445
653,COALINDIA,Coal India reports 18% fall in Q4 consolidated net profit,2023/05/08,11:14,0.212,0.323,0.465,0.2802
654,COALINDIA,Coal India - Quaterly Results,2023/05/07,12:16,0.0,0.698,0.302,0.0772
655,COALINDIA,Coal India - Quaterly Results,2023/05/07,12:16,0.0,0.698,0.302,0.0772
656,COALINDIA,"Coal India planning to invest Rs 91,000 crore in various projects by 2025-26",2023/05/05,12:07,0.228,0.421,0.351,0.1895
657,COALINDIA,Coal India informs about press release,2023/05/02,15:00,0.0,0.269,0.731,0.3445
658,COALINDIA,Coal India’s production rises by 8% to 57.6 MT in April,2023/05/02,10:00,0.175,0.5,0.325,0.2014
659,COALINDIA,Coal India informs about disclosure,2023/04/22,12:16,0.0,0.364,0.636,0.1261
660,COALINDIA,Coal India informs about disclosure,2023/04/21,16:40,0.0,0.364,0.636,0.1261
661,COALINDIA,Coal India reports 17.2% growth in coking coal production in 2022-23 ,2023/04/14,12:18,0.173,0.398,0.429,0.3008
662,COALINDIA,Coal India informs about press release ,2023/04/13,15:07,0.0,0.269,0.731,0.3445
663,COALINDIA,Coal India’s arm commissions highwall mining project in West Bengal,2023/04/12,11:16,0.097,0.356,0.547,0.2627
664,COALINDIA,Coal India aiming to supply 610 MTs coal to power sector in FY24 ,2023/04/06,12:38,0.254,0.307,0.438,0.6112
665,COALINDIA,Coal India’s production rises by 4% to 83.5 MT in March ,2023/04/03,10:46,0.259,0.416,0.324,0.197
666,COALINDIA,Coal India eyeing 16.6% growth in coal despatch to NRS customers in Q4 FY23,2023/03/24,14:51,0.212,0.532,0.256,0.1679
667,COALINDIA,Coal India informs about disclosure,2023/03/23,16:01,0.0,0.364,0.636,0.1261
668,COALINDIA,Coal India eyeing to supply 156 MTs of coal to power sector in Q1FY24 ,2023/03/14,14:59,0.298,0.289,0.412,0.609
669,COALINDIA,Coal India informs about press release,2023/03/01,16:59,0.0,0.269,0.731,0.3445
670,COALINDIA,Coal India converting abandoned mines into eco-parks,2023/02/22,12:09,0.431,0.43,0.14,-0.4037
671,COALINDIA,Coal India’s arm eyes removal of 410 MCuM of overburden materials from coal mines in FY23,2023/02/17,14:27,0.184,0.531,0.285,0.1787
672,COALINDIA,Coal India reports 69% rise in Q3 consolidated net profit,2023/02/01,10:29,0.181,0.336,0.483,0.3814
673,COALINDIA,Coal India - Quaterly Results,2023/01/31,18:02,0.0,0.698,0.302,0.0772
674,COALINDIA,Coal India - Quaterly Results,2023/01/31,18:02,0.0,0.698,0.302,0.0772
675,COALINDIA,Coal India - Quaterly Results,2023/01/31,18:02,0.0,0.698,0.302,0.0772
676,COALINDIA,Coal India’s arm develops eco-park in Odisha,2023/01/30,10:41,0.147,0.539,0.315,0.0643
677,COALINDIA,Coal India intends to produce sand using overburden rocks lying at various coal mines,2023/01/28,16:51,0.37,0.338,0.292,-0.3386
678,COALINDIA,Coal India’s arm to set up coal-based plant in Odisha,2023/01/24,12:08,0.294,0.254,0.452,0.2188
679,COALINDIA,Coal India’s arm aiming to achieve 190 million tonnes of dry fuel production in FY23,2023/01/23,09:50,0.182,0.292,0.526,0.4361
680,COALINDIA,Coal India informs about press release,2023/01/20,16:52,0.0,0.269,0.731,0.3445
681,COALINDIA,"Coal India, trade unions awaiting government's approval for wage agreement",2023/01/18,16:36,0.0,0.357,0.643,0.7184
682,COALINDIA,Coal India's arm supplies 143.4 MT of coal till December FY23,2023/01/11,13:02,0.176,0.513,0.311,0.1472
683,COALINDIA,Coal India issues letter of acceptance for nine coal mining projects,2023/01/11,11:27,0.066,0.261,0.673,0.7425
684,COALINDIA,Coal India's arm to start production of M-Sand,2023/01/11,10:30,0.224,0.221,0.554,0.2452
685,COALINDIA,Coal India’s arm aiming 7 more FMC projects by end of year 2023,2023/01/09,11:30,0.168,0.48,0.351,0.0743
686,COALINDIA,Coal India inks MoU with four central trade unions,2023/01/05,10:23,0.152,0.497,0.35,-0.0023
687,COALINDIA,Coal India informs about confirmation certificate,2023/01/04,14:41,0.209,0.435,0.357,0.0056
688,COALINDIA,Coal India’s coal supply to power sector surges 11% in April-December,2023/01/03,12:18,0.219,0.281,0.5,0.6125
689,COALINDIA,Coal India’s production rises by 10.3% to 66.4 MT in December,2023/01/02,10:29,0.175,0.5,0.325,0.2014
690,COALINDIA,Coal India’s arm commissions two electric shovels at coal mines,2022/12/28,15:28,0.197,0.465,0.338,0.1315
691,COALINDIA,Coal India eyeing to achieve production target of 700 MT for FY23,2022/12/28,10:27,0.238,0.372,0.39,0.2616
692,COALINDIA,Coal India informs about appointment of director ,2022/12/26,09:22,0.121,0.355,0.524,0.3418
693,COALINDIA,Coal India imports 3.58 lakh tonne coal from Indonesia,2022/12/20,11:20,0.0,0.613,0.387,0.1995
694,COALINDIA,Coal India informs about press release,2022/12/16,14:50,0.0,0.269,0.731,0.3445
695,COALINDIA,Coal India issues letters of acceptance for 7 coal projects,2022/12/14,15:18,0.087,0.343,0.569,0.5594
696,COALINDIA,Coal India’s production rises by 12.8% to 60.7 MT in November,2022/12/01,14:46,0.175,0.5,0.325,0.2014
697,COALINDIA,Government gives Coal India freedom to pass mine closure costs on to consumers ,2022/11/29,15:26,0.184,0.227,0.589,0.7291
698,COALINDIA,Coal India eyeing to further boost production in coming months ,2022/11/28,12:15,0.371,0.269,0.36,0.2213
699,COALINDIA,Coal India informs about press release ,2022/11/25,16:40,0.0,0.269,0.731,0.3445
700,CIPLA,Cipla to sell entire stake of 51% in Saba Investment ,2023/05/16,09:28,0.252,0.243,0.505,0.4829
701,CIPLA,Cipla reports 41% rise in Q4 consolidated net profit ,2023/05/12,16:27,0.204,0.377,0.42,0.3178
702,CIPLA,Cipla - Quaterly Results,2023/05/12,14:59,0.0,1.0,0.0,0.0
703,CIPLA,Cipla - Quaterly Results,2023/05/12,14:59,0.0,1.0,0.0,0.0
704,CIPLA,Cipla - Quaterly Results,2023/05/12,14:59,0.0,1.0,0.0,0.0
705,CIPLA,USFDA conducts routine cGMP inspection at manufacturing facility of Cipla’s arm ,2023/05/03,09:31,0.291,0.512,0.196,-0.0295
706,CIPLA,Cipla informs about allotment under ESOP,2023/04/19,12:51,0.181,0.635,0.184,0.0062
707,CIPLA,Cipla submits PCS certificate,2023/04/17,15:22,0.0,1.0,0.0,0.0
708,CIPLA,Cipla inks agreement with Novartis Pharma AG,2023/04/10,14:40,0.0,0.242,0.758,0.8133
